id,artist_name,song_title,lyrics,parent_id,chunk_order,primary_emotion,secondary_emotion,tertiary_emotion,classification_result
NF|||Hands Up|||96|||3,NF,Hands Up,"And yo, I started from the bottom, no Drake though
Yeah, I came in the game like, ""hello""
I came in the game like, ""Let's go""
Oh, this beat might break your neck bones
But that's okay, okay
You ain't heard of me, then you so late
So just take a seat of that cold plate
And just let-let-let-let me explain
Yo, ""NF"" be the logo
Capitol be the label
If I see beats on my table
I swear, I'ma eat the whole plateful
And that's my life
I write what I mean so I might
Go a little bit cray when I find mics
I ain't doing it so I am in the limelight, 'cause that limelight, it ain't nothin'
Am I in this for the money? Hey, quit crackin' jokes
'Cause we all know this industry is known for cuttin' throats
And if this was all for money, I'd have quit years ago
But it's not, so turn me up until my ears explode, let's go",NF|||Hands Up|||96,3,annoyance,disapproval,approval,"[{'label': 'neutral', 'score': 0.7190191745758057}, {'label': 'annoyance', 'score': 0.1439770758152008}, {'label': 'disapproval', 'score': 0.07676900178194046}, {'label': 'approval', 'score': 0.04959966614842415}, {'label': 'realization', 'score': 0.019418468698859215}, {'label': 'disappointment', 'score': 0.019139813259243965}]"
NF|||Hands Up|||96|||4,NF,Hands Up,"Let me see those hands up
Let me see those hands up
Let me see those hands up
Let me see those hands up
Hands up
Oh let me see those hands up
(Where you at? Where you at?)
Let me see those hands up
(Where you at? Where you at?)
Let me see those hands up
(Where you at? Where you at?)
Let me see those hands up
(Where you at? Where you at?)
Hands up
(W-w-w-w-where you at?)",NF|||Hands Up|||96,4,curiosity,excitement,confusion,"[{'label': 'neutral', 'score': 0.8795364499092102}, {'label': 'curiosity', 'score': 0.058029480278491974}, {'label': 'excitement', 'score': 0.023521047085523605}, {'label': 'confusion', 'score': 0.011081828735768795}, {'label': 'desire', 'score': 0.007137316279113293}, {'label': 'amusement', 'score': 0.0066173798404634}]"
NF|||Hands Up|||96|||5,NF,Hands Up,"Let me see those hands up
Let me see those hands up
Let me see those hands up
Let me see those hands up, hands up
Let me see those hands up
Let me see those hands up
Let me see those hands up
Let me see those hands up, hands up
<\Lyric>```",NF|||Hands Up|||96,5,curiosity,excitement,annoyance,"[{'label': 'neutral', 'score': 0.9405516386032104}, {'label': 'curiosity', 'score': 0.013999208807945251}, {'label': 'excitement', 'score': 0.008250352926552296}, {'label': 'annoyance', 'score': 0.00774411903694272}, {'label': 'confusion', 'score': 0.007495373487472534}, {'label': 'amusement', 'score': 0.006742373108863831}]"
NF|||I Got Jesus|||97|||0,NF,I Got Jesus,"```
<Artist name> NF <\Artist>
<Song title> I Got Jesus <\Song title>
<Lyric> 
Ay, yo girls, show 'em that song I taught you
I got Jesus, what you got?
I got Jesus, what you got?
I got Jesus, what you got?
Either you're saved or you're not, feel me? (*laughs*)",NF|||I Got Jesus|||97,0,amusement,curiosity,joy,"[{'label': 'neutral', 'score': 0.3832751512527466}, {'label': 'amusement', 'score': 0.3141579031944275}, {'label': 'curiosity', 'score': 0.17868150770664215}, {'label': 'joy', 'score': 0.0491248220205307}, {'label': 'confusion', 'score': 0.046077534556388855}, {'label': 'approval', 'score': 0.029201669618487358}]"
NF|||I Got Jesus|||97|||1,NF,I Got Jesus,"Yeah, yeah, yeah
Woo, woo, woo
Y'all know what this is
I got a question for y'all, man
(I'ma give it to you) Who you livin' for?
(I'ma give it to you) I know who I am
Ay, ay, ay, (let's go) ay, yeah
I got Jesus, (come on) what you got?
I got Jesus, what you got? (yeah)
I got Jesus, what you got?
Either you saved or you not (yeah)
I got Jesus, what you got? (come on)
I got Jesus, (yeah) what you got?
I got (let's go) Jesus, what you got? (haha)
(Yeah) Either you saved (yeah)",NF|||I Got Jesus|||97,1,amusement,curiosity,joy,"[{'label': 'amusement', 'score': 0.6477563381195068}, {'label': 'neutral', 'score': 0.24080108106136322}, {'label': 'curiosity', 'score': 0.10552893579006195}, {'label': 'joy', 'score': 0.07711469382047653}, {'label': 'approval', 'score': 0.030062558129429817}, {'label': 'excitement', 'score': 0.020632794126868248}]"
NF|||I Got Jesus|||97|||2,NF,I Got Jesus,"Yo, my God, He's so powerful
Either get with Him or Satan will devour you
Overpower you, and demolish you
Have you wrapped up, runnin' like a coward do
And yo, it's crazy, look around
I was always taught the devil's under the ground
But is he under me now?
I don't really feel that way
He around us around in the world today
I got Jesus, I'm not scared
If you got a problem, He's right there
He's right here, this ain't no lie
Forget about the world, I'm with God in the sky
You don't need money, you don't need fame
All you gotta do is rep His Name
You rep that chain
It ain't gonna save you, dude
Forget the world, don't listen what they sayin' to you",NF|||I Got Jesus|||97,2,annoyance,approval,disapproval,"[{'label': 'neutral', 'score': 0.5424767136573792}, {'label': 'annoyance', 'score': 0.09314325451850891}, {'label': 'approval', 'score': 0.08585885912179947}, {'label': 'disapproval', 'score': 0.051882293075323105}, {'label': 'caring', 'score': 0.04453339800238609}, {'label': 'anger', 'score': 0.024216026067733765}]"
NF|||I Got Jesus|||97|||3,NF,I Got Jesus,"I got Jesus, what you got?
I got Jesus, what you got?
I got Jesus, what you got?
Either you saved or you not (yea-uh)
I got Jesus, what you got?
I got Jesus, what you got?
I got Jesus, what you got?
Either you saved or you not",NF|||I Got Jesus|||97,3,curiosity,confusion,approval,"[{'label': 'neutral', 'score': 0.6961475014686584}, {'label': 'curiosity', 'score': 0.252144992351532}, {'label': 'confusion', 'score': 0.064372219145298}, {'label': 'approval', 'score': 0.05202341824769974}, {'label': 'optimism', 'score': 0.008383996784687042}, {'label': 'love', 'score': 0.006615897174924612}]"
NF|||I Got Jesus|||97|||4,NF,I Got Jesus,"(Nah) Tryin' to confuse it is somethin' I would try do
You watch TV, yeah, they gon' lie to you
Have your mind mixed up in a bad position
Like, ""Hey, everybody, let's laugh at Christians""
(Come on!) Like, ""That don't make sense to me
Why should I have to repent for things?
Why would a god that loves me so
Leave me in a world so broke, so cold?""
People askin' the wrong questions
Someone gave you the wrong message (come on)
Why would a god that's fake come down to this earth to get socked in the face? (socked in the face)
Died for His faith, did nothin' wrong
Thorns in His head, nails in His palms
You don't get it?
Why would I lie to you?
He don't love you, then why would He die for you?",NF|||I Got Jesus|||97,4,disappointment,confusion,curiosity,"[{'label': 'neutral', 'score': 0.2963896691799164}, {'label': 'disappointment', 'score': 0.18370014429092407}, {'label': 'confusion', 'score': 0.173493891954422}, {'label': 'curiosity', 'score': 0.1535874605178833}, {'label': 'annoyance', 'score': 0.14943505823612213}, {'label': 'sadness', 'score': 0.09393927454948425}]"
NF|||I Got Jesus|||97|||5,NF,I Got Jesus,"I got Jesus, what you got?
I got Jesus, what you got?
I got Jesus, what you got?
Either you saved or you not (I need Jesus)
I got Jesus, what you got?
I got Jesus, what you got?
I got Jesus, what you got?
Either you saved or you not (yea-uh)
(Or you not)",NF|||I Got Jesus|||97,5,curiosity,confusion,approval,"[{'label': 'neutral', 'score': 0.7256613373756409}, {'label': 'curiosity', 'score': 0.23181377351284027}, {'label': 'confusion', 'score': 0.05233030766248703}, {'label': 'approval', 'score': 0.045588694512844086}, {'label': 'optimism', 'score': 0.008366200141608715}, {'label': 'love', 'score': 0.006706250831484795}]"
NF|||I Got Jesus|||97|||6,NF,I Got Jesus,"Jesus came down to this earth to die for our sins
He sent His only begotten Son to save us
The least we can do is praise Him (praise Him)
You gotta give it to God, man
Check it out
I'ma show you how real He is",NF|||I Got Jesus|||97,6,admiration,approval,caring,"[{'label': 'neutral', 'score': 0.7354360222816467}, {'label': 'admiration', 'score': 0.12425108253955841}, {'label': 'approval', 'score': 0.07655973732471466}, {'label': 'caring', 'score': 0.030098160728812218}, {'label': 'annoyance', 'score': 0.009897241368889809}, {'label': 'optimism', 'score': 0.006765051744878292}]"
NF|||I Got Jesus|||97|||7,NF,I Got Jesus,"Yeah, God made man
God made trees
God made you
God made me
Our God took a little bit of dirt and made man
Imagine where your life could go in His hands
You don't understand, picture this:
Thorns in His head, nails in His wrist
Streched like this
Dying for us, yeah, extraordinary
In God, I trust
He died for me, I died for Him
He died perfect, Lord I've sinned
Take me in, set me free
Without You, I'm not me
We're not worthy of Your Grace
But you show it, Lord, so thanks
Satan mad 'cause we believin'
He don't like it when we screamin' (*laughs*)",NF|||I Got Jesus|||97,7,gratitude,annoyance,disapproval,"[{'label': 'gratitude', 'score': 0.5296748280525208}, {'label': 'neutral', 'score': 0.1933402717113495}, {'label': 'annoyance', 'score': 0.035548608750104904}, {'label': 'disapproval', 'score': 0.030104251578450203}, {'label': 'amusement', 'score': 0.02619720622897148}, {'label': 'sadness', 'score': 0.01705474779009819}]"
NF|||I Got Jesus|||97|||8,NF,I Got Jesus,"I got Jesus, what you got?
I got Jesus, what you got?
I got Jesus, what you got?
Either you saved or you not (yea-uh)
I got Jesus, what you got?
I got Jesus, what you got?
I got Jesus, what you got?
Either you saved or you not
I got Jesus, what you got? (come on)
I got Jesus, what you got?
I got Jesus, what you got? (yea-uh, man)
Either you saved or you not
I got Jesus, what you got? (yeah)
I got Jesus, what you got? (yeah)
I got Jesus, what you got?
Either you saved or you not (or you not)",NF|||I Got Jesus|||97,8,curiosity,confusion,approval,"[{'label': 'neutral', 'score': 0.7716634273529053}, {'label': 'curiosity', 'score': 0.21019086241722107}, {'label': 'confusion', 'score': 0.07688838988542557}, {'label': 'approval', 'score': 0.03264918178319931}, {'label': 'realization', 'score': 0.0065803611651062965}, {'label': 'annoyance', 'score': 0.005504061933606863}]"
NF|||I Got Jesus|||97|||9,NF,I Got Jesus,"So many people walk around in their own little world
Living for things that won't satisfy
And you won't feel satisfied until you find the One True God
If you don't look for the truth, how are you supposed to find it?
I got Him, what you got?
Yeah, and that's the truth, y'all
You don't look for the truth, you not gonna find the truth, most of us
Without Jesus, you're nothing
What you got?
Ay, girls, you think you got the song down yet?
I got it Jessie, do you got it?
Yeah
I think we're better than Nathan
Yeah (laughs)
<\Lyric>```",NF|||I Got Jesus|||97,9,approval,curiosity,optimism,"[{'label': 'approval', 'score': 0.4527849853038788}, {'label': 'neutral', 'score': 0.3016993999481201}, {'label': 'curiosity', 'score': 0.10855836421251297}, {'label': 'optimism', 'score': 0.061706699430942535}, {'label': 'amusement', 'score': 0.057429853826761246}, {'label': 'disapproval', 'score': 0.027440812438726425}]"
NF|||CLOUDS (Edit)|||98|||0,NF,CLOUDS (Edit),"```
<Artist name> NF <\Artist>
<Song title> CLOUDS (Edit) <\Song title>
<Lyric> 
Calmly feel myself evolving
Appalling, so much I'm not divulging
Been stalling, I think I hear applauding, they're calling
Mixtapes aren't my thing but it's been awfully
Exhausting, hanging onto songs this long is daunting (Yeah)
Which caused me to have make a call I thought was ballsy
Resulting in what you see today, proceed indulging
As always, the one-trick pony sing it, so quit your sulking",NF|||CLOUDS (Edit)|||98,0,disappointment,annoyance,sadness,"[{'label': 'disappointment', 'score': 0.2845556437969208}, {'label': 'neutral', 'score': 0.22812509536743164}, {'label': 'annoyance', 'score': 0.1653296947479248}, {'label': 'sadness', 'score': 0.08926427364349365}, {'label': 'disapproval', 'score': 0.07142791152000427}, {'label': 'disgust', 'score': 0.05507912486791611}]"
NF|||CLOUDS (Edit)|||98|||1,NF,CLOUDS (Edit),"Born efficient, got ambition, sorta vicious, yep, that's me
Not artistic, unrealistic, chauvinistic, not those things
Go the distance, so prolific, post too cryptic, move swiftly
Unsubmissive, the king of mischief
The golden ticket, rare sight to see
I stay committed, embrace the rigid
I'm playful with it, yeah, basically
Too great to mimic, you hate, you bitter
No favoritism, that's fine with me
Creatе the riddles, portrayed uncivil
Unsafе a little, oh, yes, indeed
It's plain and simple, I'm far from brittle
Unbreakable, you following?
I'm Bruce Willis in a train wreck
I'm like trading in your car for a new jet
I'm like having a boss getting upset
'Cause you asked him for less on your paycheck
I'm like doing headstands with a broke neck
I'm like watching your kid take his first steps
I'm like saying Bill Gates couldn't pay rent
'Cause he's too broke, where I'm going with this?",NF|||CLOUDS (Edit)|||98,1,annoyance,approval,anger,"[{'label': 'neutral', 'score': 0.30821692943573}, {'label': 'annoyance', 'score': 0.2767074406147003}, {'label': 'approval', 'score': 0.18628855049610138}, {'label': 'anger', 'score': 0.06861386448144913}, {'label': 'disapproval', 'score': 0.064613476395607}, {'label': 'curiosity', 'score': 0.037618301808834076}]"
NF|||CLOUDS (Edit)|||98|||2,NF,CLOUDS (Edit),"Unbelievable, yes, yes, inconceivable
See myself as fairly reasonable
But at times I can be stubborn
So, if I have to I will rock the boat
I don't tend to take the easy road
That's just not the way I like to roll
What you think's probably unfeasible
I've done already a hundredfold, a hundredfold
It's probable, that I might press the envelope
Ideas so astronomical
Sometimes I find them comical
Yeah, incomparable, replay value phenomenal
Beat selection, remarkable, slowing me down, impossible",NF|||CLOUDS (Edit)|||98,2,disapproval,approval,annoyance,"[{'label': 'neutral', 'score': 0.2649923264980316}, {'label': 'disapproval', 'score': 0.2519586980342865}, {'label': 'approval', 'score': 0.06293072551488876}, {'label': 'annoyance', 'score': 0.05798909068107605}, {'label': 'amusement', 'score': 0.05557066574692726}, {'label': 'surprise', 'score': 0.043135229498147964}]"
NF|||CLOUDS (Edit)|||98|||3,NF,CLOUDS (Edit),"I don't rock no Rollies
I don't hang around no phonies (Yep)
I don't really got no trophies
I don't know why God chose me (I don't know)
Got something in the cup, ain't codeine (Never)
Change my style, they told me
Now they come around like, ""Homie""
Man, y'all better back up slowly, back up slowly, woo",NF|||CLOUDS (Edit)|||98,3,confusion,disapproval,disappointment,"[{'label': 'confusion', 'score': 0.3974741995334625}, {'label': 'neutral', 'score': 0.2862926423549652}, {'label': 'disapproval', 'score': 0.2632341682910919}, {'label': 'disappointment', 'score': 0.1316724717617035}, {'label': 'annoyance', 'score': 0.10025732964277267}, {'label': 'realization', 'score': 0.02919137105345726}]"
NF|||CLOUDS (Edit)|||98|||4,NF,CLOUDS (Edit),"Who are you kidding?
How could you doubt me? I've always delivered
Ripping the teeth out of the back of my mouth
The closest you get to my wisdom
See my initial thought was to wait, but what can I say? I had come to visit
Check on you guys, you doin' alright?
Your year really sucked? Yeah, that's what I figured
They cover they heads up whenever I drop
Shake the whole industry, put 'em in shock
Come out the clouds like a meteor rock
Then land on the earth like ""Ready or not?""
Ain't no one like me, the cream of the crop
Don't even front better, give me some props
I pick up your body and throw it a block
Okay, I admit it, that's over the top, not
Deer in the headlights looks every time I step my foot
On the ground I get mistook for a lame with no weight to his name
Ground just shook, let's not beat around the bush
Even my B-sides throw 'em off like how's he do it?
Some say I'm a great influence
I don't know about that, but I did do the best I could",NF|||CLOUDS (Edit)|||98,4,annoyance,disappointment,curiosity,"[{'label': 'neutral', 'score': 0.3996570408344269}, {'label': 'annoyance', 'score': 0.23285159468650818}, {'label': 'disappointment', 'score': 0.15488409996032715}, {'label': 'curiosity', 'score': 0.09432347118854523}, {'label': 'confusion', 'score': 0.044323887676000595}, {'label': 'approval', 'score': 0.04067765921354294}]"
NF|||CLOUDS (Edit)|||98|||5,NF,CLOUDS (Edit),"Hollywood, Hollywood, hope Nate doesn't go Hollywood
You think that y'all know me good
You think that y'all know me good
Hollywood, Hollywood, hope Nate doesn't go Hollywood
You think that y'all know me good
You think that y'all know me",NF|||CLOUDS (Edit)|||98,5,optimism,desire,approval,"[{'label': 'neutral', 'score': 0.7511885166168213}, {'label': 'optimism', 'score': 0.41961470246315}, {'label': 'desire', 'score': 0.02467457763850689}, {'label': 'approval', 'score': 0.015353003516793251}, {'label': 'realization', 'score': 0.00955046433955431}, {'label': 'disapproval', 'score': 0.008244683034718037}]"
NF|||CLOUDS (Edit)|||98|||6,NF,CLOUDS (Edit),"I, I, I, I, I always advance
Say how I feel, you know where I stand
Raising the bar, I gotta expand
Top of the charts, I'm setting up camp
Pound in my stakes, I put up my tent
Shoot for the stars, they fall in my hand
Stick to my guns, I don't even flinch
Can push all you want, ain't movin' an inch
I rarely miss, you know I'm relentless
Ain't got a choice, no way to prevent it
Just who I am and I don't regret it
See what I want and then I go get it
Followed my gut, I'm happy I did it
Beat all the odds, I ain't got no limits
Cannot be stopped, you paying attention?
I ain't gotta say it, they know where my head is
They know where my head is (Head is)
<\Lyric>```",NF|||CLOUDS (Edit)|||98,6,approval,joy,excitement,"[{'label': 'neutral', 'score': 0.49425816535949707}, {'label': 'approval', 'score': 0.31635430455207825}, {'label': 'joy', 'score': 0.18368065357208252}, {'label': 'excitement', 'score': 0.01956278458237648}, {'label': 'realization', 'score': 0.013589908368885517}, {'label': 'caring', 'score': 0.012624330818653107}]"
NF|||Miss You|||99|||0,NF,Miss You,"```
<Artist name> NF <\Artist>
<Song title> Miss You <\Song title>
<Lyric> 
Oh, I miss you
Whoa, I miss you
Now you're gone, yeah
Now you're gone
Oh, I miss you, yeah
Oh, I miss you
Oh, now you're gone, yeah, yeah
Now you're gone, no",NF|||Miss You|||99,0,sadness,disappointment,grief,"[{'label': 'sadness', 'score': 0.9124034643173218}, {'label': 'disappointment', 'score': 0.09675637632608414}, {'label': 'grief', 'score': 0.05014235898852348}, {'label': 'neutral', 'score': 0.029336534440517426}, {'label': 'love', 'score': 0.025936773046851158}, {'label': 'realization', 'score': 0.02223074436187744}]"
NF|||Miss You|||99|||1,NF,Miss You,"I should have been there, told you that I loved ya
Held a little tighter as I kiss, and when I hug ya
I should have called ya, told you that I missed ya
Tears on my face as I'm lookin' at your pictures
Yeah, I'm with ya, but only in this mindset
Since you've been gone you ain't never left my mind yet
And I'm upset, not because of you
I wish all I remember was the good, I never do
I guess when you lose somethin', that's when you appreciate it
If you were here, then I'd show you my appreciation
But you're not, so I'mma have to learn to cope with it
Got a box of memories, but I'm scared to open it
I see you smilin', but only when I'm dreamin'
I know you're gone forever, but somehow I don't believe it
Somebody wake me up, my eyes closin'
I'm hopin' some day you'll be there when they open, but",NF|||Miss You|||99,1,desire,sadness,disappointment,"[{'label': 'desire', 'score': 0.49474936723709106}, {'label': 'sadness', 'score': 0.33654841780662537}, {'label': 'disappointment', 'score': 0.18674197793006897}, {'label': 'love', 'score': 0.06162397190928459}, {'label': 'neutral', 'score': 0.05005112662911415}, {'label': 'fear', 'score': 0.029967745766043663}]"
NF|||Miss You|||99|||2,NF,Miss You,"I never thought I'd have to say goodbye to you so soon
But now you're gone (And now you're gone)
And now you're gone (And now you're gone)
I never thought I'd have to say goodbye but now I do
And I miss you (And I miss you)
Oh, I miss you (Oh, I miss you)",NF|||Miss You|||99,2,sadness,disappointment,grief,"[{'label': 'sadness', 'score': 0.8826852440834045}, {'label': 'disappointment', 'score': 0.14445149898529053}, {'label': 'grief', 'score': 0.05127521604299545}, {'label': 'realization', 'score': 0.050529394298791885}, {'label': 'neutral', 'score': 0.03611406683921814}, {'label': 'surprise', 'score': 0.030631741508841515}]"
NF|||Miss You|||99|||3,NF,Miss You,"Yeah, I wish you can hear me, I know you don't
And I wish you would call me, I know that you won't
But why I gotta cry? Sick o' dwellin' on the negative
Use what you love, it'll will take you where you never been
Yo, depression, naw, far from it
Have I cried? Oh, yeah, I've done it
If I could I'd change, and I'd go back
Problem is if we could, yeah, we'd all do that
I can see you laughin' in my memories
Sad part is that's the only thing I'll ever see
Used to wear a tough face and play pretend
Now the fact is I'm never going to see you again
See, my life just doesn't seem right without ya
I can feel the tears comin' when I think about ya
Matter fact, I think I feel some now
I'm sick of holdin' them back, that's why I'm lettin' them out",NF|||Miss You|||99,3,sadness,desire,disappointment,"[{'label': 'sadness', 'score': 0.8095827102661133}, {'label': 'desire', 'score': 0.2063971608877182}, {'label': 'disappointment', 'score': 0.18091712892055511}, {'label': 'curiosity', 'score': 0.061847858130931854}, {'label': 'neutral', 'score': 0.0560992993414402}, {'label': 'remorse', 'score': 0.029672149568796158}]"
NF|||Miss You|||99|||4,NF,Miss You,"I look in the mirror, I can see you in my face
I could care less now about your mistakes
Not 'cause they don't bother me, not 'cause they ain't bruise me
I just kinda feel like you ain't never knew me
I'm all mixed up, lost in the emotion
Loved you so much, too bad I never showed it
Yeah, but on the upside there's one thing
You put a smile on my face most times I sing, so
Mom, if you were here today, I would put my arms around you
And tell you I love you, yeah
I'd tell you I love you, I'd tell you I love you
Yeah, I would put your hand in mine, and tell you everything's okay
Oh, I miss you
Oh, I miss you, yeah, yeah",NF|||Miss You|||99,4,love,sadness,disappointment,"[{'label': 'love', 'score': 0.8862206339836121}, {'label': 'sadness', 'score': 0.4661068022251129}, {'label': 'disappointment', 'score': 0.10054414719343185}, {'label': 'desire', 'score': 0.04746681824326515}, {'label': 'caring', 'score': 0.03630262613296509}, {'label': 'neutral', 'score': 0.02279030531644821}]"
NF|||Miss You|||99|||5,NF,Miss You,"La da da
La da da da da
La da da
La da da da da
<\Lyric>```",NF|||Miss You|||99,5,approval,realization,annoyance,"[{'label': 'neutral', 'score': 0.9587875604629517}, {'label': 'approval', 'score': 0.013420398347079754}, {'label': 'realization', 'score': 0.005615724250674248}, {'label': 'annoyance', 'score': 0.005332800094038248}, {'label': 'excitement', 'score': 0.004371886607259512}, {'label': 'admiration', 'score': 0.004157892428338528}]"
NF|||Falling Apart|||100|||0,NF,Falling Apart,"```
<Artist name> NF <\Artist>
<Song title> Falling Apart <\Song title>
<Lyric> 
You say that you love me
Let's talk about it
And you swear that you'll always be there
I doubt it
When I look in those eyes
I can tell you're lying
All those tears that you cry
Why do you keep denying",NF|||Falling Apart|||100,0,confusion,annoyance,curiosity,"[{'label': 'neutral', 'score': 0.3386387825012207}, {'label': 'confusion', 'score': 0.21292418241500854}, {'label': 'annoyance', 'score': 0.11118762195110321}, {'label': 'curiosity', 'score': 0.1098138615489006}, {'label': 'disappointment', 'score': 0.09387286752462387}, {'label': 'sadness', 'score': 0.05951370298862457}]"
NF|||Falling Apart|||100|||1,NF,Falling Apart,"You say that you care but I know you're lying
Please spare me the tears
There'll be no sympathizing
I act like I'm fine
But you're antagonizing
My heart is falling apart",NF|||Falling Apart|||100,1,sadness,disappointment,annoyance,"[{'label': 'sadness', 'score': 0.5985859632492065}, {'label': 'disappointment', 'score': 0.19241110980510712}, {'label': 'neutral', 'score': 0.1316760629415512}, {'label': 'annoyance', 'score': 0.09299713373184204}, {'label': 'disapproval', 'score': 0.03648489713668823}, {'label': 'anger', 'score': 0.03293216601014137}]"
NF|||Falling Apart|||100|||2,NF,Falling Apart,"We lay in my bed, so irritated
All the things that we said
Yeah, it's so frustrating
Who am I to tell you that you're not perfect
It's just that I thought that you were a different person
We smile and pretend like nothing matters
When in fact, in the end, it just makes us madder",NF|||Falling Apart|||100,2,annoyance,anger,disappointment,"[{'label': 'annoyance', 'score': 0.761210560798645}, {'label': 'anger', 'score': 0.23381906747817993}, {'label': 'neutral', 'score': 0.1156727746129036}, {'label': 'disappointment', 'score': 0.06947238743305206}, {'label': 'disapproval', 'score': 0.040239933878183365}, {'label': 'realization', 'score': 0.01869051717221737}]"
