id,artist_name,song_title,lyrics,parent_id,chunk_order,primary_emotion,secondary_emotion,tertiary_emotion,classification_result
NF|||Let You Down|||0|||0,NF,Let You Down,"```
<Artist name> NF <\Artist>
<Song title> Let You Down <\Song title>
<Lyric> 
Feels like we're on the edge right now
I wish that I could say I'm proud
I'm sorry that I let you down
Let you down
All these voices in my head get loud
I wish that I could shut them out
I'm sorry that I let you down
Le-le-let you down",NF|||Let You Down|||0,0,desire,remorse,sadness,"[{'label': 'desire', 'score': 0.6019863486289978}, {'label': 'remorse', 'score': 0.26026690006256104}, {'label': 'sadness', 'score': 0.1913636028766632}, {'label': 'disappointment', 'score': 0.07440885901451111}, {'label': 'neutral', 'score': 0.043234650045633316}, {'label': 'optimism', 'score': 0.026613133028149605}]"
NF|||Let You Down|||0|||1,NF,Let You Down,"Yeah, I guess I'm a disappointment, doin' everything I can
I don't wanna make you disappointed, it's annoying
I just wanna make you feel like everything I ever do
Was never tryna make an issue for you, but I guess the more you
Thought about everything you were never even wrong
In the first place, right? Yeah, I'ma just ignore you
Walking towards you with my head down
Lookin' at the ground, I'm embarrassed for you
Paranoia, what did I do wrong this time?
That's parents for you
Very loyal? Shoulda had my back
But you put a knife in it´, my hands are full
What else should I carry for you?
I cared for you, but",NF|||Let You Down|||0,1,disappointment,embarrassment,annoyance,"[{'label': 'disappointment', 'score': 0.38771703839302063}, {'label': 'embarrassment', 'score': 0.23499780893325806}, {'label': 'annoyance', 'score': 0.18221913278102875}, {'label': 'curiosity', 'score': 0.14337670803070068}, {'label': 'sadness', 'score': 0.08382080495357513}, {'label': 'confusion', 'score': 0.045888714492321014}]"
NF|||Let You Down|||0|||2,NF,Let You Down,"Feels like we're on the edge right now
I wish that I could say I'm proud
I'm sorry that I let you down
Le-le-let you down
All these voices in my head get loud
I wish that I could shut them out
I'm sorry that I let you down
Le-le-let you down",NF|||Let You Down|||0,2,desire,remorse,sadness,"[{'label': 'desire', 'score': 0.6336696743965149}, {'label': 'remorse', 'score': 0.23867394030094147}, {'label': 'sadness', 'score': 0.17095378041267395}, {'label': 'disappointment', 'score': 0.06711523979902267}, {'label': 'neutral', 'score': 0.04551762342453003}, {'label': 'optimism', 'score': 0.027408134192228317}]"
NF|||Let You Down|||0|||3,NF,Let You Down,"Yeah, you don't wanna make this work
You just wanna make this worse
Want me to listen to you, but you don't ever hear my words
You don't wanna know my hurt, yeah
Let me guess, you want an apology, probably
How can we keep going at a rate like this?
We can't, so I guess I'ma have to leave
Please, don't come after me
I just wanna be alone right now, I don't really wanna think at all
Go ahead, just drink it off
Both know you're gonna call tomorrow like nothing's wrong
Ain't that what you always do?
I feel like every time I talk to you, you're in an awful mood
What else can I offer you?
There's nothing left right now, I gave it all to you",NF|||Let You Down|||0,3,annoyance,disappointment,sadness,"[{'label': 'annoyance', 'score': 0.28427350521087646}, {'label': 'disappointment', 'score': 0.2526746094226837}, {'label': 'sadness', 'score': 0.2288706749677658}, {'label': 'neutral', 'score': 0.18645676970481873}, {'label': 'disapproval', 'score': 0.09487492591142654}, {'label': 'anger', 'score': 0.0655035674571991}]"
NF|||Let You Down|||0|||4,NF,Let You Down,"Yeah, don't talk down to me
That's not gonna work now
Packed all my clothes and I moved out
I don't even wanna go to your house
Every time I sit on that couch
I feel like you lecture me, eventually, I bet that we
Coulda made this work
And prolly woulda figured things out
But I guess I'm a letdown
But it's cool, I checked out
Oh, you wanna be friends now?
Okay, let's put my fake face on and pretend now
Sit around and talk about the good times that didn't even happen
I mean, why are you laughing?
Must have missed that joke, let me see if I can find a reaction
No, but at least you're happy",NF|||Let You Down|||0,4,annoyance,disappointment,joy,"[{'label': 'annoyance', 'score': 0.36764010787010193}, {'label': 'disappointment', 'score': 0.18681566417217255}, {'label': 'neutral', 'score': 0.16780848801136017}, {'label': 'joy', 'score': 0.10553476214408875}, {'label': 'disapproval', 'score': 0.09350521862506866}, {'label': 'amusement', 'score': 0.06956653296947479}]"
NF|||Let You Down|||0|||5,NF,Let You Down,"Feels like we're on the edge right now
I wish that I could say I'm proud
I'm sorry that I let you down
Oh, I let you down
All these voices in my head get loud
And I wish that I could shut them out
I'm sorry that I let you down
Oh, let you down",NF|||Let You Down|||0,5,desire,remorse,sadness,"[{'label': 'desire', 'score': 0.5969882607460022}, {'label': 'remorse', 'score': 0.2543507516384125}, {'label': 'sadness', 'score': 0.22085890173912048}, {'label': 'disappointment', 'score': 0.08673038333654404}, {'label': 'neutral', 'score': 0.041315287351608276}, {'label': 'optimism', 'score': 0.02581600658595562}]"
NF|||Let You Down|||0|||6,NF,Let You Down,"Yeah, I'm sorry
I'm so sorry now
Yeah, I'm sorry that I let you down
<\Lyric>```",NF|||Let You Down|||0,6,remorse,sadness,approval,"[{'label': 'remorse', 'score': 0.7800905108451843}, {'label': 'sadness', 'score': 0.3281165361404419}, {'label': 'approval', 'score': 0.031324852257966995}, {'label': 'caring', 'score': 0.02424643188714981}, {'label': 'disappointment', 'score': 0.023913796991109848}, {'label': 'neutral', 'score': 0.019854886457324028}]"
NF|||The Search|||1|||0,NF,The Search,"```
<Artist name> NF <\Artist>
<Song title> The Search <\Song title>
<Lyric> 
""Hey, Nate, how's life?""
I don’t know, it's alright
I've been dealin’ with some things like every human being
And really didn't sleep much last night (Last night)
""I'm sorry,"" that's fine
I just think I need a little me time
I just think I need a little free time
Little break from the shows and the bus rides, yeah (Bus rides)
Last year I had a breakdown
Thoughts tellin' me I'm lost gettin' too loud
Had to see a therapist, then I found out
Somethin' funny’s goin’ on up in my house
Yeah, I started thinkin' maybe I should move out
You know, pack my cart, take a new route
Clean up my yard, get the noose out
Hang up my heart, let it air out (Air out)
I’ve been searchin'
""What does that mean, Nate?"" I've been learning
Grabbin' my keepsakes, leavin’ my burdens
Well, I brought a few with me, I'm not perfect
Lookin' at the view, like this concerns me
Pickin' up the cues, right? I'm quite nervous
Hate it when I lose sight, life gets blurry
And things might hurt me
It's prolly gonna be a long journey, but hey (But hey)
It's worth it, though
Cold world out there, kids, grab your coats
It's been a minute, I know, now I'm back to roam
Lookin' for the antidote to crack the code
Pretty vivid; I admit it, I'm in classic mode
Don't need pity given to me, but I can't condone
Talkin' down to me, I'ma have to crack your nose for crackin' jokes
I'm lookin' for the map to hope, you seen it? (You seen it?)
Been makin' a whole lot of changes
Wrote a song about that, you should play it
I get scared when I walk on these stages
I look at the crowd and see so many faces, yeah
That's when I start to get anxious
That's when my thoughts can be dangerous
That's when I put on my makeup and drown in self-hatred
Forget what I'm sayin', and—
Where'd the beat go?
Oh, ain't that somethin'?
Drums came in, you ain't see that comin'
Hands on my head, can't tell me nothin'
Got a taste of the fame, had to pump my stomach
Throw it back up like I don't want it
Wipe my face, clean off my vomit
OCD, tryna push my buttons
I said don't touch it, now y'all done it
I can be critical, never typical
Intricate with every syllable, I'm a criminal
Intimate, but never political, pretty visual
Even if you hate it, I'll make it feel like you're in it, though
You call me what you wanna, but never call me forgettable
Leave you deep in thought, I could never swim in the kiddie pool
Way that I been thinkin' is cinematic, it's beautiful
Man, I don't know if I'm makin' movies or music videos (Videos, videos, videos)
Yeah, the sales can rise
Doesn't mean much though when your health declines
See, we've all got somethin' that we trapped inside
That we try to suffocate, you know, hopin' it dies
Try to hold it underwater but it always survives
Then it comes up outta nowhere like an evil surprise
Then it hovers over you to tell you millions of lies
You don't relate to that? Must not be as crazy as I am
The point I'm makin' is the mind is a powerful place
And what you feed it can affect you in a powerful way
It's pretty cool, right? Yeah, but it's not always safe
Just hang with me, this'll only take a moment, okay?
Just think about it for a second, if you look at your face
Every day when you get up and think you'll never be great
You'll never be great—not because you're not, but the hate
Will always find a way to cut you up and murder your faith, woo
I've been developin', take a look at the benefits
Nothin' to meddle with, I can never be delicate
Am I even relevant? That depends how you measure it
Take a measurement, then bag it up and give me the evidence
Pretty evident; dependable can never be tentative
I'm a gentleman, depending on if I think you're genuine
Pretty elegant, but not afraid to tell you to get a grip
Proper etiquette, I keep it to myself when I celebrate, ah (Ah)
It's that time again
Better grab your balloons and invite your friends
Seatbelts back on, yeah, strap 'em in
Look at me, everybody, I'm smilin' big
On a road right now that I can't predict
Tell me ""Tone that down,"" but I can't resist
Y'all know that sound, better raise your fist
The search begins, I'm back, so enjoy the trip, huh",NF|||The Search|||1,0,nervousness,fear,sadness,"[{'label': 'nervousness', 'score': 0.5116354823112488}, {'label': 'fear', 'score': 0.1751682013273239}, {'label': 'sadness', 'score': 0.1617591828107834}, {'label': 'realization', 'score': 0.09454866498708725}, {'label': 'approval', 'score': 0.07595200091600418}, {'label': 'neutral', 'score': 0.06516996026039124}]"
NF|||When I Grow Up|||2|||0,NF,When I Grow Up,"```
<Artist name> NF <\Artist>
<Song title> When I Grow Up <\Song title>
<Lyric> 
Yeah, when I grow up, you know what I wanna be?
Take a seat, let me tell you my ridiculous dreams
I wanna rap, yeah, I know it's hard to believe
And I can tell you're already thinkin' I will never succeed
But I'm okay with it, I admit the lyrics are weak
I've been workin' on 'em, I'll be good eventually
I understand you gotta crawl before you get to your feet
But I been running for a while, they ain't ready for me, ahh
I know this prolly isn't really realistic
And honestly, I might not ever make a difference
But that don't make a difference, I'ma have to risk it
I've been crunchin' numbers, you ain't gotta be a mathematician
To see the odds ain't rootin' for me
I can't lie though, it's kinda how I like it to be
The underdog, yeah, you prolly think you know what I mean
But what I'm saying is they ever push me, I'm gonna swing, yeah
I could go to college, get in debt like everybody else
Graduate and prolly get a job that doesn't pay the bills
That don't make a lot of sense to me, forget the Happy Meals
I don't like the dollar menu, I would rather make a meal
Huh? Make a mil'? Nah, I said make a meal
Home-cookin', get the grill, how you want it? Pretty well?
Everything I see is overdone to me, I'm not Adele
But I'ma get a record deal and say hello to mass appeal",NF|||When I Grow Up|||2,0,disapproval,approval,disappointment,"[{'label': 'disapproval', 'score': 0.30516883730888367}, {'label': 'approval', 'score': 0.26073554158210754}, {'label': 'neutral', 'score': 0.2277376502752304}, {'label': 'disappointment', 'score': 0.15851837396621704}, {'label': 'annoyance', 'score': 0.12134788185358047}, {'label': 'realization', 'score': 0.030739564448595047}]"
NF|||When I Grow Up|||2|||1,NF,When I Grow Up,"When I grow up, I just want to pay my bills
Rappin' about the way I feel (Oh, yeah)
I just want to make a couple mil'
Leave it to the fam in the will (Oh, yeah)
I just want to sign a record deal
Maybe buy a house up in the hills (Oh, yeah)
Might not be the best in my field
But I guarantee that I'ma die real
When I grow up",NF|||When I Grow Up|||2,1,desire,optimism,approval,"[{'label': 'desire', 'score': 0.7763880491256714}, {'label': 'neutral', 'score': 0.15865764021873474}, {'label': 'optimism', 'score': 0.09601140022277832}, {'label': 'approval', 'score': 0.01905476301908493}, {'label': 'annoyance', 'score': 0.01579197682440281}, {'label': 'disappointment', 'score': 0.012724536471068859}]"
NF|||When I Grow Up|||2|||2,NF,When I Grow Up,"Yeah, ayy
When I grow up
Yeah, yeah, ayy",NF|||When I Grow Up|||2,2,approval,realization,excitement,"[{'label': 'neutral', 'score': 0.8155391812324524}, {'label': 'approval', 'score': 0.07802730053663254}, {'label': 'realization', 'score': 0.03250489756464958}, {'label': 'excitement', 'score': 0.0151384761556983}, {'label': 'amusement', 'score': 0.00857350043952465}, {'label': 'joy', 'score': 0.007752565201371908}]"
NF|||When I Grow Up|||2|||3,NF,When I Grow Up,"I'ma make 'em notice me, rhymin' like it's poetry
Everything I oversee, I just like to overthink
Mockin' me, you pay the fee, no return and no receipts
Those of you that don't believe, quiet, you don't know a thing
Quiet when I'm tryna sing, quiet when I'm making beats
Quiet when I'm tryna think, sorry, I don't mean to scream
I just feel like no one really gets me and it's sad to see
'Cause someday I'ma grow up and show all of you it's meant to be (Yeah)
Anybody wanna hear me rap? ""No""
Come on, let me play a couple tracks, ""No""
Come on, I can spit it really fast, ""No""
You think I should throw this in the trash? ""No""
Tricked ya; haters, go away before I hit ya
I am not a beggar or a kiss-up
You don't understand? Well, I forgive ya
I am not a quitter, you ain't really think that, did ya?
Maybe someday I could even be up on the radio
Have a tour bus and maybe even play a couple shows
Everybody in the crowd singing every word I wrote
Tellin' me that I am not the only one that feels alone
Huh? You feel alone? Yeah, I kinda feel alone
Wonder if that feelin' ever goes away when you get old
Will I ever make it as an artist? I don't really know
Might not make a lot of dough
I'ma have to try it, though",NF|||When I Grow Up|||2,3,sadness,disappointment,curiosity,"[{'label': 'sadness', 'score': 0.7236686944961548}, {'label': 'disappointment', 'score': 0.37126967310905457}, {'label': 'curiosity', 'score': 0.18001094460487366}, {'label': 'neutral', 'score': 0.06115676462650299}, {'label': 'confusion', 'score': 0.04542843997478485}, {'label': 'remorse', 'score': 0.044805679470300674}]"
NF|||When I Grow Up|||2|||4,NF,When I Grow Up,"When I grow up
I just wanna pay my bills
Rappin' about the way I feel (Oh, yeah)
I just wanna make a couple mil'
Leave it to the fam in the will (Oh, yeah)
(Leave it to the fam in the will)
(Yeah, yeah, yeah, yeah)
I just wanna sign a record deal
Maybe buy a house up in the hills (Okay, oh, yeah)
Might not be the best in my field (Ayy, ayy, yeah)
But I guarantee that I'ma die real
When I grow up
I just wanna pay my bills (Woo)
Rappin' about the way I feel (Oh, yeah)
(Yeah, the way I feel)
Yeah, I just wanna make a couple mil' (Ayy, couple mil')
Leave it to the fam in the will (Oh, yeah, to the fam in the will)
I just wanna sign a record deal (Woo)
Maybe buy a house up in the hills (Oh, yeah)
(House up in the hills)
Yeah, I might not be the best in my field
But I guarantee that I'ma die real
When I grow up
When I grow up
<\Lyric>```",NF|||When I Grow Up|||2,4,desire,optimism,disappointment,"[{'label': 'desire', 'score': 0.5692952871322632}, {'label': 'neutral', 'score': 0.3942592740058899}, {'label': 'optimism', 'score': 0.06344903260469437}, {'label': 'disappointment', 'score': 0.0246430654078722}, {'label': 'annoyance', 'score': 0.021399304270744324}, {'label': 'approval', 'score': 0.02128039114177227}]"
NF|||Leave Me Alone|||3|||0,NF,Leave Me Alone,"```
<Artist name> NF <\Artist>
<Song title> Leave Me Alone <\Song title>
<Lyric> 
(Yeah)
Hey!
Leave me alone",NF|||Leave Me Alone|||3,0,annoyance,sadness,anger,"[{'label': 'neutral', 'score': 0.7987507581710815}, {'label': 'annoyance', 'score': 0.09895290434360504}, {'label': 'sadness', 'score': 0.04145507887005806}, {'label': 'anger', 'score': 0.037915442138910294}, {'label': 'disappointment', 'score': 0.0330381877720356}, {'label': 'disgust', 'score': 0.00926793459802866}]"
NF|||Leave Me Alone|||3|||1,NF,Leave Me Alone,"Panic-stricken, handle business, not a joke, yeah
Manners missin', travel different, no control, yeah
Time to listen, time to zip it, keep it closed
My description, highly gifted, take some notes, yeah
Lack of interest, why'd you visit? Hit the road, yeah
I'm kinda twisted, so keep your distance, be a ghost
Yeah, see I'm inventive, but quite the menace, you ain't know?
Well then I'm offended, let's jog your memories, here we go, yeah
I went from nobody to kinda famous
Hide my plaques inside the closet, I just can't explain it
My wife, she tells me that she's proud and thinks that I should hang 'em
But I just leave 'em on the ground right next to my self-hatred
Yeah, yeah, mental health, where's my mental health?
Diagnosed with OCD, what does that mean? Well, gather 'round
That means I obsessively obsess on things I think about
That means I might take a normal thought and think it's so profound (Leave me alone)
Ruminating, fill balloons up full of doubts
Do the same things, if I don't, I'm overwhelmed (Leave me alone)
Thoughts are pacing, they go 'round and 'round and 'round
It's so draining, let's move onto something else, fine (Oh) (Leave me alone)
Runnin' the game, but they don't even know it
Like I'm undercover and don't wanna blow it
I come out of nowhere, they don't even notice
The flow is so cold, you would think it was snowin' (Oh) (Leave me alone)
I'm under the weather, but wind isn't blowin'
I got an umbrella for difficult moments
You got to admit it, I'm very devoted
I'm out in the rain, but it don't always open, so I (I, I)",NF|||Leave Me Alone|||3,1,annoyance,disappointment,curiosity,"[{'label': 'annoyance', 'score': 0.2877489924430847}, {'label': 'disappointment', 'score': 0.18021421134471893}, {'label': 'neutral', 'score': 0.16675984859466553}, {'label': 'curiosity', 'score': 0.10475397855043411}, {'label': 'confusion', 'score': 0.06843172013759613}, {'label': 'disapproval', 'score': 0.051150232553482056}]"
NF|||Leave Me Alone|||3|||2,NF,Leave Me Alone,"Hold up my balloons and cover up my face
I can feel them weighin' on me every day
I should let 'em go and watch 'em float away
But I'm scared if I do, then I'll be more afraid (More afraid)
Tell them how I feel, but they don't wanna change (Don't wanna change)
Tell them how I feel, but they remain the same (Same)
Loosen up my grip, they say that's not okay
Quiet, quiet, quiet, quiet, quiet, ayy, leave me alone! (Oh)",NF|||Leave Me Alone|||3,2,fear,nervousness,realization,"[{'label': 'fear', 'score': 0.7977120280265808}, {'label': 'neutral', 'score': 0.2277320921421051}, {'label': 'nervousness', 'score': 0.04003309831023216}, {'label': 'realization', 'score': 0.019915549084544182}, {'label': 'approval', 'score': 0.01812526397407055}, {'label': 'sadness', 'score': 0.016777245327830315}]"
NF|||Leave Me Alone|||3|||3,NF,Leave Me Alone,"Ayy, yeah
Quiet, quiet, quiet, quiet, ayy (Yeah), leave me alone
Woo, yeah
Quiet, quiet, quiet, quiet, ayy (Yeah), leave me alone! (Leave me alone)",NF|||Leave Me Alone|||3,3,annoyance,anger,amusement,"[{'label': 'neutral', 'score': 0.8275691866874695}, {'label': 'annoyance', 'score': 0.10011328011751175}, {'label': 'anger', 'score': 0.055310413241386414}, {'label': 'amusement', 'score': 0.009823870845139027}, {'label': 'disgust', 'score': 0.007468093652278185}, {'label': 'sadness', 'score': 0.007151338737457991}]"
NF|||Leave Me Alone|||3|||4,NF,Leave Me Alone,"I hate when they debate if we're underrated
We're so overlooked that they're lookin' over our numbers, Nathan (Leave me alone)
We don't do enough interviews or go out in public lately
We don't post enough on our socials
To keep the buzz from fading (Leave me alone)
Let it fade, yeah, let it fade
Once it's decimated, then you drop a song outta nowhere
And all the fans embrace it (Leave me alone)
Then the buzz will surface again, it's part of my operation
I don't need advice from my doubts right now
End of conversation (Leave me alone)
Shut your mouth, yeah, shut your mouth
Better tone it down, close it now
If you make a sound, I'ma change the dial (Leave me alone)
Funny how they be acting loud, comin' unannounced
It's floating 'round
Man, the kid is wild, pretty vile, true (Leave me alone)
I'm kinda funny but don't really show it
I keep it together but have a disorder
I go to my room and I sit in my corner
And talk to myself in a language that's foreign (Leave me alone)
I think of a rhyme and I have to record it
But know if I don't, I'll wake up in the mornin'
And question my life again, always avoiding
I hate to be different, but hate to be normal, so I (Leave me alone)",NF|||Leave Me Alone|||3,4,amusement,annoyance,anger,"[{'label': 'amusement', 'score': 0.48827633261680603}, {'label': 'annoyance', 'score': 0.36022937297821045}, {'label': 'anger', 'score': 0.10877606272697449}, {'label': 'neutral', 'score': 0.08193203061819077}, {'label': 'disapproval', 'score': 0.07287740707397461}, {'label': 'disgust', 'score': 0.030673731118440628}]"
NF|||Leave Me Alone|||3|||5,NF,Leave Me Alone,"Hold up my balloons and cover up my face
I can feel them weighin' on me every day
I should let 'em go and watch 'em float away
But I'm scared if I do, then I'll be more afraid
Tell them how I feel, but they don't wanna change (Wanna change)
Tell them how I feel but they remain the same (They remain the same)
Loosen up my grip, they say that's not okay
Quiet, quiet, quiet, quiet, quiet, ayy
Leave me alone",NF|||Leave Me Alone|||3,5,fear,nervousness,realization,"[{'label': 'fear', 'score': 0.653788685798645}, {'label': 'neutral', 'score': 0.41433343291282654}, {'label': 'nervousness', 'score': 0.029803385958075523}, {'label': 'realization', 'score': 0.019279304891824722}, {'label': 'approval', 'score': 0.016311274841427803}, {'label': 'sadness', 'score': 0.015204326249659061}]"
NF|||Leave Me Alone|||3|||6,NF,Leave Me Alone,"Ayy, yeah
Quiet, quiet, quiet, quiet, ayy (Yeah), leave me alone
Woo, yeah
Quiet, quiet, quiet, quiet, ayy (Yeah), leave me alone",NF|||Leave Me Alone|||3,6,annoyance,anger,amusement,"[{'label': 'neutral', 'score': 0.83431476354599}, {'label': 'annoyance', 'score': 0.09334497898817062}, {'label': 'anger', 'score': 0.03190863877534866}, {'label': 'amusement', 'score': 0.010689138434827328}, {'label': 'sadness', 'score': 0.010471146553754807}, {'label': 'disappointment', 'score': 0.009944256395101547}]"
NF|||Leave Me Alone|||3|||7,NF,Leave Me Alone,"Remember back in ""NO NAME,"" I said fame called? (Yeah, yeah)
Told you I hung up, it kinda felt wrong (Leave me alone) (Wrong, wrong)
Finally called him back, we didn't talk long (No)
He asked me how I'd been, I sent him this song (Leave me alone, quiet, quiet, quiet)
Yeah, think he took offense, he kinda seemed off (Off)
I texted him that night to ask what he thought (Leave me alone, quiet, quiet, quiet)
It took a couple days to get a response
But once I finally did, he said this song sucks (Leave me alone, quiet, quiet, quiet)
Feel the symptoms, couldn't miss 'em, wrestle with 'em
Then I pin and flip 'em, brought some back up
No, well, you should get some (Leave me alone, quiet, quiet, quiet)
Who you dissin'? Mood is switchin', don't come in the kitchen
You should listen, cookin' record for my hands are blisterin'
So persistent, don't forget this, hold the tension, soul is bendin'
No pretendin', open-ended, low percentage, so demented (Leave me alone)
Whole consensus, flow tremendous, no apprentice, dope incentive
Show intensive, so possessive, tone aggressive, watch your step when I (Leave me alone)",NF|||Leave Me Alone|||3,7,annoyance,disappointment,disapproval,"[{'label': 'neutral', 'score': 0.7345882058143616}, {'label': 'annoyance', 'score': 0.2682870328426361}, {'label': 'disappointment', 'score': 0.06766052544116974}, {'label': 'disapproval', 'score': 0.05089450255036354}, {'label': 'realization', 'score': 0.020038412883877754}, {'label': 'anger', 'score': 0.015303192660212517}]"
NF|||Leave Me Alone|||3|||8,NF,Leave Me Alone,"Hold up my balloons and cover up my face (Up my face)
I can feel them weighin' on me every day (Yeah, every day)
I should let 'em go and watch them float away (Yeah, float away)
But I'm scared if I do then I'll be more afraid
Leave me alone (Yeah), leave me alone, yeah (Yeah, yeah, yeah)
Leave me alone, leave me alone (Yeah, yeah, yeah)
Leave me alone, leave me alone (Yeah, leave me alone)
Yeah, leave me alone, leave me alone, ayy, leave me alone",NF|||Leave Me Alone|||3,8,fear,nervousness,anger,"[{'label': 'fear', 'score': 0.8495279550552368}, {'label': 'neutral', 'score': 0.15079265832901}, {'label': 'nervousness', 'score': 0.03900889307260513}, {'label': 'anger', 'score': 0.027729550376534462}, {'label': 'sadness', 'score': 0.023880787193775177}, {'label': 'annoyance', 'score': 0.021815991029143333}]"
