id,artist_name,song_title,lyrics,parent_id,chunk_order,primary_emotion,secondary_emotion,tertiary_emotion,classification_result
NF|||Can You Hold Me|||60|||1,NF,Can You Hold Me,"Tears on my face I can't take it
If lonely is a taste then it's all that I'm tasting
Do you hear my cry?
I cry, oh",NF|||Can You Hold Me|||60,1,sadness,curiosity,disappointment,"[{'label': 'sadness', 'score': 0.8899754881858826}, {'label': 'curiosity', 'score': 0.08803581446409225}, {'label': 'disappointment', 'score': 0.05526023358106613}, {'label': 'neutral', 'score': 0.05159281566739082}, {'label': 'grief', 'score': 0.039575520902872086}, {'label': 'remorse', 'score': 0.020324205979704857}]"
NF|||Can You Hold Me|||60|||2,NF,Can You Hold Me,"Can you hold me?
Can you hold me?
Can you hold me in your arms?",NF|||Can You Hold Me|||60,2,curiosity,confusion,caring,"[{'label': 'curiosity', 'score': 0.48760730028152466}, {'label': 'neutral', 'score': 0.40718820691108704}, {'label': 'confusion', 'score': 0.07519049197435379}, {'label': 'caring', 'score': 0.030288083478808403}, {'label': 'love', 'score': 0.02360473945736885}, {'label': 'desire', 'score': 0.014448212459683418}]"
NF|||Can You Hold Me|||60|||3,NF,Can You Hold Me,"Just wrap me in your arms, in your arms
I don't wanna be nowhere else
Take me from the dark, from the dark
I ain't gonna make it myself
Put your arms around me
Put your arms around me
Let your love surround me
I am lost
I am lost",NF|||Can You Hold Me|||60,3,love,sadness,caring,"[{'label': 'neutral', 'score': 0.4423055052757263}, {'label': 'love', 'score': 0.27979931235313416}, {'label': 'sadness', 'score': 0.21957789361476898}, {'label': 'caring', 'score': 0.05344792827963829}, {'label': 'desire', 'score': 0.03422872722148895}, {'label': 'disappointment', 'score': 0.026109587401151657}]"
NF|||Can You Hold Me|||60|||4,NF,Can You Hold Me,"If I ain't got you here
If I ain't got you, I ain't got nothing at all",NF|||Can You Hold Me|||60,4,disapproval,annoyance,disappointment,"[{'label': 'neutral', 'score': 0.8268364667892456}, {'label': 'disapproval', 'score': 0.16191348433494568}, {'label': 'annoyance', 'score': 0.04351552575826645}, {'label': 'disappointment', 'score': 0.013622577302157879}, {'label': 'approval', 'score': 0.011156921274960041}, {'label': 'realization', 'score': 0.01107021328061819}]"
NF|||Can You Hold Me|||60|||5,NF,Can You Hold Me,"Can you hold me?
Can you hold me?
Can you hold me in your arms?
In your arms",NF|||Can You Hold Me|||60,5,curiosity,confusion,caring,"[{'label': 'neutral', 'score': 0.5116972923278809}, {'label': 'curiosity', 'score': 0.38138845562934875}, {'label': 'confusion', 'score': 0.06487741321325302}, {'label': 'caring', 'score': 0.027809925377368927}, {'label': 'love', 'score': 0.02555324137210846}, {'label': 'desire', 'score': 0.012139648199081421}]"
NF|||Can You Hold Me|||60|||6,NF,Can You Hold Me,"Yeah, yeah
Yeah, I feel like it's just me, like it's just me
What it gon' take? What it gon' be?
I don't even know
(It's not just you)
But I'm lonely
Feeling like I don't even know me, I don't even know me
(I feel it too)
Gotta have you, gotta see you
(You're the only thing I have to think about
The only one I that can't live without)
I see you
(I need you, need you to hold me now)If I ain't got you
If I ain't got you
I ain't got nothing
I ain't got nothing
If I ain't got you
I ain't got you
If I ain't got you
I'm lonely
If I ain't with you I'm lonely
I'm lonely
I need you
I need youCan you hold me?",NF|||Can You Hold Me|||60,6,sadness,disappointment,curiosity,"[{'label': 'sadness', 'score': 0.7416984438896179}, {'label': 'disappointment', 'score': 0.3064105212688446}, {'label': 'neutral', 'score': 0.08482199907302856}, {'label': 'curiosity', 'score': 0.04795018956065178}, {'label': 'confusion', 'score': 0.036561448127031326}, {'label': 'annoyance', 'score': 0.03377774730324745}]"
NF|||Can You Hold Me|||60|||7,NF,Can You Hold Me,Can you hold me?,NF|||Can You Hold Me|||60,7,curiosity,confusion,desire,"[{'label': 'curiosity', 'score': 0.5015138387680054}, {'label': 'neutral', 'score': 0.4262702167034149}, {'label': 'confusion', 'score': 0.04985291510820389}, {'label': 'desire', 'score': 0.026728300377726555}, {'label': 'caring', 'score': 0.0228745024651289}, {'label': 'love', 'score': 0.013684842735528946}]"
NF|||Can You Hold Me|||60|||8,NF,Can You Hold Me,"Can you hold me in your arms?
Can you hold me?
Can you hold me?
Can you hold me in your arms?Feel like it's just me, like it's just me
What it gon' take? What it gon' be?
I don't even know, I don't even know
But I'm lonely, lonely
Feel like I don't even know me
Feels like I don't even know me
I don't even know meCan you hold me?",NF|||Can You Hold Me|||60,8,sadness,disappointment,curiosity,"[{'label': 'sadness', 'score': 0.7683023810386658}, {'label': 'disappointment', 'score': 0.24595880508422852}, {'label': 'curiosity', 'score': 0.12221281975507736}, {'label': 'neutral', 'score': 0.07205595821142197}, {'label': 'confusion', 'score': 0.06530787795782089}, {'label': 'nervousness', 'score': 0.030720112845301628}]"
NF|||Can You Hold Me|||60|||9,NF,Can You Hold Me,"Can you hold me in your arms?
<\Lyric>```",NF|||Can You Hold Me|||60,9,curiosity,caring,desire,"[{'label': 'curiosity', 'score': 0.4128637909889221}, {'label': 'neutral', 'score': 0.3422382175922394}, {'label': 'caring', 'score': 0.05462607368826866}, {'label': 'desire', 'score': 0.04443758726119995}, {'label': 'confusion', 'score': 0.03901221975684166}, {'label': 'love', 'score': 0.03309863433241844}]"
NF|||Grindin’|||61|||0,NF,Grindin’,"```
<Artist name> NF <\Artist>
<Song title> Grindin’ <\Song title>
<Lyric> 
Oh yeah (oh yeah!)
Just let me work, no, just let me work, no
I'm out here grindin'
Yeah, I'm out here grindin' (woo!)
I told 'em (oh yeah!) that I'm out here grindin'
I'm out here gri—(hey, hey!)",NF|||Grindin’|||61,0,excitement,approval,annoyance,"[{'label': 'neutral', 'score': 0.807645857334137}, {'label': 'excitement', 'score': 0.0588449202477932}, {'label': 'approval', 'score': 0.05430135130882263}, {'label': 'annoyance', 'score': 0.02193482220172882}, {'label': 'joy', 'score': 0.018875135108828545}, {'label': 'amusement', 'score': 0.011472117155790329}]"
NF|||Grindin’|||61|||1,NF,Grindin’,"You ain't never heard nothin' like this
Let me work, show me where the mic is
I'm on stage, black shirt, in my Timbs
You know how I do it, I ain't playin' with you, I've been grindin' Anybody tryna sleep on me better do somethin' with your eyelids
I hear a lot of whinin', but I don’t hear a lot of rhymin', woo!
Everybody got opinions, let it go into my ear and then I block that
Put me on stage, I'ma rock that
Sayin' you the best? Stop that
Phony, I am not that, yeah
What are y'all doin' out here? What are y'all doin' out here?
Maybe you should spend a little less time with the women in your arms and a little bit more with your career
I ain't saying I'm the best, but I should be in the top ten; give me a list of names, I'ma top them
I'm just playing with ya, I don't care where the top is
Leave me at the bottom, let me work for it
You ain't never gonna find another rapper in the game and tell me that he works more
Tell me that he works more, nah!
You might see me with my hoodie up, I ain't leaving 'til I finish
This industry ain't nothing but a box, but I ain't gon' climb in it
You put me inside a room full of rappers, come back in five minutes
I'ma be the only one still alive, with a note on my chest saying that I did it!
You do it for fame, we are way different
Y'all are looking weak, we ain't cooking in the same kitchen
Everybody got a shirt with a stain in it
Some of us'll never wear it out though, lemme get it!
I guess I don't understand
This wasn't part of my plan
Some of these people, they're thinking 'cause they heard the name that they really know who I am
Bring the beat down!
I got no time for these Hollywood people, I'd rather give time to my fans
You'd rather chill with these women that like you for money
But I'd rather chill with my fam, yeah
I'm out here grindin'
I'm out here grindin'
Yeah, I see the mic but you looking like a pilot
What's the point of a plane if you don't know how to fly it?
Yeah!",NF|||Grindin’|||61,1,annoyance,disapproval,curiosity,"[{'label': 'neutral', 'score': 0.6064605116844177}, {'label': 'annoyance', 'score': 0.2245457023382187}, {'label': 'disapproval', 'score': 0.09471730142831802}, {'label': 'curiosity', 'score': 0.05764118954539299}, {'label': 'confusion', 'score': 0.04560631141066551}, {'label': 'approval', 'score': 0.03001534938812256}]"
NF|||Grindin’|||61|||2,NF,Grindin’,"I'm out here grindin', okay okay okay
I'm out here grindin', okay okay okay
I'm out here grindin', okay okay okay
I'm out here grindin', all I do is work, all I do is work",NF|||Grindin’|||61,2,approval,annoyance,realization,"[{'label': 'neutral', 'score': 0.6723708510398865}, {'label': 'approval', 'score': 0.32948780059814453}, {'label': 'annoyance', 'score': 0.021942751482129097}, {'label': 'realization', 'score': 0.013897118158638477}, {'label': 'optimism', 'score': 0.005269480869174004}, {'label': 'admiration', 'score': 0.0034521908964961767}]"
NF|||Grindin’|||61|||3,NF,Grindin’,"Rise of the underdog, I don't like none of y'all
I'm not like one of y'all
I'm from the jungle, I run with the son of God
Yeah, what is you running for?
They should be running from me
Most of my family, we don't even speak
I'm getting married in 22 weeks
And they still haven't said ""Hi"" or wanted to meet, huh?
I'm not the type to complain
If we don't get it, we try it again
And I'd die for the gang, Misfit my blood
They don't like us and we question they mom like
""Why did—why did you allow your kid to like bad music?""
Woo! Promise I do it (woo!)
I'm tryna give you my everything
I don't care what they are doing
I'm tryna do what they couldn't do
Laugh at the rappers you look up to
Don't waste time with the centerfolds (ay!)
I'm alive, it's a miracle (ooh)
Freestylin' since middle school (woo!)
I will battle the principal (woo!)
Wear all black like a funeral
I'm doing me, I don't live for you (ayy!)
Grindin'!",NF|||Grindin’|||61,3,annoyance,amusement,disapproval,"[{'label': 'neutral', 'score': 0.4233807921409607}, {'label': 'annoyance', 'score': 0.19083188474178314}, {'label': 'amusement', 'score': 0.053770266473293304}, {'label': 'disapproval', 'score': 0.05317003279924393}, {'label': 'joy', 'score': 0.03775251656770706}, {'label': 'anger', 'score': 0.035368431359529495}]"
NF|||Grindin’|||61|||4,NF,Grindin’,"I'm out here grindin', okay okay okay
I'm out here grindin', okay okay okay
I'm out here grindin', okay okay okay
I'm out here grindin', all I do is work, all I do is work
I'm out here grindin', okay okay okay
I'm out here grindin', okay okay okay
I'm out here grindin', okay okay okay
I'm out here grindin', all I do is work, all I do is work
I'm grindin'",NF|||Grindin’|||61,4,approval,realization,annoyance,"[{'label': 'neutral', 'score': 0.6601604223251343}, {'label': 'approval', 'score': 0.36177870631217957}, {'label': 'realization', 'score': 0.01530742458999157}, {'label': 'annoyance', 'score': 0.015277553349733353}, {'label': 'optimism', 'score': 0.004606184083968401}, {'label': 'admiration', 'score': 0.003179227001965046}]"
NF|||Grindin’|||61|||5,NF,Grindin’,"Oh yeah, oh yeah, oh yeah
I'm out here, I'm out here grindin'
All I, all I, all I do is work
All I, all I, all I do is grind (woo!)
<\Lyric>```",NF|||Grindin’|||61,5,excitement,approval,joy,"[{'label': 'neutral', 'score': 0.7005403637886047}, {'label': 'excitement', 'score': 0.1597740203142166}, {'label': 'approval', 'score': 0.05887919291853905}, {'label': 'joy', 'score': 0.03574592247605324}, {'label': 'admiration', 'score': 0.02267206273972988}, {'label': 'annoyance', 'score': 0.0163427647203207}]"
NF|||Breathe|||62|||0,NF,Breathe,"```
<Artist name> NF <\Artist>
<Song title> Breathe <\Song title>
<Lyric> 
Breathe
Breathe",NF|||Breathe|||62,0,approval,annoyance,disgust,"[{'label': 'neutral', 'score': 0.9060642123222351}, {'label': 'approval', 'score': 0.01917324587702751}, {'label': 'annoyance', 'score': 0.011213450692594051}, {'label': 'disgust', 'score': 0.00989849865436554}, {'label': 'love', 'score': 0.00812957901507616}, {'label': 'excitement', 'score': 0.007273443043231964}]"
NF|||Breathe|||62|||1,NF,Breathe,"I grew up in a small place, had to drive an hour just to see a movie
I'm a simple person, city life just doesn't move me
I'd rather be home with my grandparents and playing Euchre
Didn't wanna leave but this dream's calling, I had to do it
I left my girl there, wish I would've done it different
She was right when she told me that I don't ever listen
I told her I would change a million times and never did it
Apologies don't mean a thing if you don't ever fix it
I love what I do but it's not what I expected
This industry is not your friend, well that's my perspective
Sometimes the closest people to you make you feel protected
But those are the same people that hurt you most and leave you guessing
Some people say nobody's perfect but expect perfection
How you supposed to find the answer if you don't ask the question?
Sometimes I look into the mirror and talk to my reflection
When I go home and turn the music off, what am I left with?",NF|||Breathe|||62,1,love,disappointment,sadness,"[{'label': 'love', 'score': 0.30029115080833435}, {'label': 'disappointment', 'score': 0.27019065618515015}, {'label': 'sadness', 'score': 0.1586127132177353}, {'label': 'disapproval', 'score': 0.14044727385044098}, {'label': 'curiosity', 'score': 0.10683349519968033}, {'label': 'remorse', 'score': 0.10149452835321426}]"
NF|||Breathe|||62|||2,NF,Breathe,"We used to be close but as time passed, we became disconnected
You never felt love and I always felt disrespected
Your family thought I was a joke, I was always defensive
They just wanted what was best for you, I just couldn't accept it
And hurting you was not a part of my plan or my intentions
But I was immature, I guess I had to learn some lessons
We grew apart and our lives went in different directions
And there's a lot of responsibilities that I neglected
I had a lot that was bottled inside, couldn't express it
And this pain won't leave, I can feel the depression
It's taking over my body, feels like I'm always stressing
Doctor told me I should sleep, but I'm always restless
I lay awake at night and think, my thoughts are relentless
I need a moment to breathe, I need a moment to vent this
I seem to be the only person that I play pretend with
And when I turn the music off, what am I really left with huh?
<\Lyric>```",NF|||Breathe|||62,2,sadness,disappointment,annoyance,"[{'label': 'sadness', 'score': 0.5953031182289124}, {'label': 'disappointment', 'score': 0.39671993255615234}, {'label': 'neutral', 'score': 0.06894661486148834}, {'label': 'annoyance', 'score': 0.06258100271224976}, {'label': 'nervousness', 'score': 0.035257209092378616}, {'label': 'curiosity', 'score': 0.026095934212207794}]"
NF|||MISTAKE|||63|||0,NF,MISTAKE,"```
<Artist name> NF <\Artist>
<Song title> MISTAKE <\Song title>
<Lyric> 
I feel like I'm at a standstill
Waitin' for you to tell me I'm okay
If time heals, tell me, why do I kill
Myself tryna show you I'm not a mistake?
I've got qualities that I'm not proud of
I've made promises that I walked out on
I've had days I feel I don't deserve love
So think what you think, just don't call me a",NF|||MISTAKE|||63,0,annoyance,disappointment,anger,"[{'label': 'annoyance', 'score': 0.35646969079971313}, {'label': 'neutral', 'score': 0.19585365056991577}, {'label': 'disappointment', 'score': 0.1696166694164276}, {'label': 'anger', 'score': 0.12270371615886688}, {'label': 'disapproval', 'score': 0.11377960443496704}, {'label': 'sadness', 'score': 0.057565394788980484}]"
NF|||MISTAKE|||63|||1,NF,MISTAKE,"Mistake, might've made some
Can't argue with that, but I ain't one
Even though I sometimes get afraid of
Havin' to face the wrath of an anxious me
I get it 'cause I actually
Feel the same, sometimes I think
I might be a lost cause
Who turns off, 'cause the way I read
Into what I've been through
You think I'm mental, but it pays off though
When the rent's due, I pursue what I love
And if it goes south and falls down, just know
I stand on my own two feet
Don't you see those that oppose on me?
Most won't leave, thinkin' I might retreat
Show my teeth quick if you turn on me 'cause",NF|||MISTAKE|||63,1,fear,approval,nervousness,"[{'label': 'fear', 'score': 0.3814702332019806}, {'label': 'approval', 'score': 0.20898379385471344}, {'label': 'neutral', 'score': 0.14529827237129211}, {'label': 'nervousness', 'score': 0.10251952707767487}, {'label': 'love', 'score': 0.10088437795639038}, {'label': 'confusion', 'score': 0.09454329311847687}]"
NF|||MISTAKE|||63|||2,NF,MISTAKE,"I feel like I'm at a standstill
Waitin' for you to tell me I'm okay
If time heals, tell me, why do I kill
Myself tryna show you I'm not a mistake?
I've got qualities that I'm not proud of
I've made promises that I walked out on
I've had days I feel I don't deserve love
So think what you think, just don't call me a—",NF|||MISTAKE|||63,2,annoyance,anger,disappointment,"[{'label': 'annoyance', 'score': 0.4141770601272583}, {'label': 'neutral', 'score': 0.19363288581371307}, {'label': 'anger', 'score': 0.1635693460702896}, {'label': 'disappointment', 'score': 0.15252940356731415}, {'label': 'disapproval', 'score': 0.11091833561658859}, {'label': 'sadness', 'score': 0.04734944924712181}]"
NF|||MISTAKE|||63|||3,NF,MISTAKE,"Just don't call me a—
Just don't call me a",NF|||MISTAKE|||63,3,annoyance,anger,disapproval,"[{'label': 'neutral', 'score': 0.5120483636856079}, {'label': 'annoyance', 'score': 0.2544136345386505}, {'label': 'anger', 'score': 0.1853499412536621}, {'label': 'disapproval', 'score': 0.16427212953567505}, {'label': 'approval', 'score': 0.01124818716198206}, {'label': 'caring', 'score': 0.010937013663351536}]"
NF|||MISTAKE|||63|||4,NF,MISTAKE,"Mistake 'cause I'm not one
Misplaced, but I found a
Lot of resentment causes a mess
When you let it get to the place of
No confidence
Struggle with it, that's obvious
But not enough to make me second-guess
If I'd die for the ones I love
So don't you get confused, thinkin' if you bring me down
I'ma just choose to let myself get used
I don't live like that, I feel trapped
I might lash out, I gotta watch my back
Cross my path, 'specially with ill intent
You'll regret you ever took that task
If and when this thing could all go bad
Don't you act like no one warned you yet 'cause",NF|||MISTAKE|||63,4,annoyance,disappointment,disapproval,"[{'label': 'annoyance', 'score': 0.21862463653087616}, {'label': 'disappointment', 'score': 0.1525627225637436}, {'label': 'neutral', 'score': 0.14937275648117065}, {'label': 'disapproval', 'score': 0.0813428983092308}, {'label': 'remorse', 'score': 0.0715675801038742}, {'label': 'sadness', 'score': 0.06427454203367233}]"
NF|||MISTAKE|||63|||5,NF,MISTAKE,"Mistake
<\Lyric>```",NF|||MISTAKE|||63,5,embarrassment,realization,annoyance,"[{'label': 'neutral', 'score': 0.6062183976173401}, {'label': 'embarrassment', 'score': 0.09199532866477966}, {'label': 'realization', 'score': 0.06103217601776123}, {'label': 'annoyance', 'score': 0.058892082422971725}, {'label': 'disappointment', 'score': 0.04243455454707146}, {'label': 'remorse', 'score': 0.03687064349651337}]"
NF|||Warm Up|||64|||0,NF,Warm Up,"```
<Artist name> NF <\Artist>
<Song title> Warm Up <\Song title>
<Lyric> 
Yeah
Somethin' for the fans
Yeah",NF|||Warm Up|||64,0,approval,realization,annoyance,"[{'label': 'neutral', 'score': 0.9114363789558411}, {'label': 'approval', 'score': 0.07867536693811417}, {'label': 'realization', 'score': 0.011122233234345913}, {'label': 'annoyance', 'score': 0.007028684020042419}, {'label': 'excitement', 'score': 0.003775930032134056}, {'label': 'optimism', 'score': 0.003242626553401351}]"
NF|||Warm Up|||64|||1,NF,Warm Up,"I'm the type to rent a hotel room just to feel at home (Just to feel at home)
I'm the type to rent a hotel room just to be alone (Just to be alone, yeah)
I got an issue with people pretendin' they like what they don't
Please don't bring up my issues unless you gon' deal with your own
Please don't try to pretend like you keep it real, though
Yeah, it's funny that you got a lotta money
But that money doesn't buy you skills, though
I don't care if I am on the billboards
On a killin' spree, I'm 'bout to kill more
Got a chain on you paid a mill' for (Woo)
I mean what you people even live for?
I write raps, you steal yours, oh Lord (Haha)
We just gettin' warmed up (Woo)
Yeah, I said I was comin', I warned you (Ah)
So close to the fans, I feel like they ride on my tour bus
You wanna know what I do in my downtime? They come to my fortress
I apologize for all the corpses
It's a mess right now, but I haven't had time to put the rappers in the coffins (Yeah)
We ain't talked in like six years, why you writin' me now?
I just turned a 100K down, just to keep the brand lookin' right, now (That's real)
I ain't braggin' 'bout the money, I'm just sayin' I ain't controlled by the bank account
Or the bank amounts, I'm a business man
But don't touch my money, I don't play around, woo
Lights out when the mic's out
'Bout to hit the West Coast, hype crowds
I just put a record out, what you think I'm gonna pipe down?
Nah, I've been lookin' for a beat, look what I found, woo
I mean everything is comin' out of my mouth
Tried to tell me, yeah, I ain't had the right sound
Oh yeah? Well, tell me what you think now
Two records in the bag, I ain't done, no
What's comin' next year? Let me hear the drum roll
Don't flow, anybody wanna be the one
To make an issue out of nothin'? I'ma hit you with my iPhone
I know, I'm a little out of hand now
I ain't lookin' for a handout
You ain't like what I was doin' last year which is funny
'Cause you lookin' like a fan now, are you a fan now?
I kinda miss bein' broke, now let me go back to my old days
When I used to walk into high school and hand out my CD in hallways
I told all my teachers that I'd be a rapper, they smiled and looked at me, ""Okay
That's a pretty nice dream, but you better get a real job."" Mmm, no way
Yeah, I live what you dreamin' (Oh)
I could do this while I'm sleepin'
I ain't the type that'll bring up your name for nothin'
But please, don't give me a reason
I'm on the edge now, I ain't playin' with you
Never really been a fan of takin' pictures
I'm just bein' honest, yeah, I'll take it with you
Shows sellin' out, better get your tickets, oh Lord
I got a love for the fans
I can't express what it feels like (Oh yeah)
Sometimes I wonder if it's even real life
Sometimes I look at the past and think about how I got here in the first place
You know the glove is my birthplace
I don't wanna be rude, but I could get you on my worst days
Say nothin' for me, do it all the time
Yeah, they barely workin' while I'm workin' overtime
Last year they like, ""Who am I?""
Now this year they like, ""You the guy""
Here's a lil' some' for your car rides
If they said I fell off, they all lied
Yeah, you know the logo, better recognize
Yeah, it's Real Music 'til the day we die, yeah
<\Lyric>```",NF|||Warm Up|||64,1,amusement,joy,annoyance,"[{'label': 'amusement', 'score': 0.8210060596466064}, {'label': 'neutral', 'score': 0.12239476293325424}, {'label': 'joy', 'score': 0.07773635536432266}, {'label': 'annoyance', 'score': 0.07123223692178726}, {'label': 'curiosity', 'score': 0.05153699964284897}, {'label': 'disapproval', 'score': 0.04289614409208298}]"
NF|||I’ll Keep On|||65|||0,NF,I’ll Keep On,"```
<Artist name> NF <\Artist>
<Song title> I’ll Keep On <\Song title>
<Lyric> 
Oh these hands are tired
Oh this heart is tired
Oh this soul is tired
But I'll keep on
I'll keep on
I'll keep on
I'll keep on
I'll keep on
I'll keep on",NF|||I’ll Keep On|||65,0,sadness,disappointment,approval,"[{'label': 'neutral', 'score': 0.7151926755905151}, {'label': 'sadness', 'score': 0.06356406956911087}, {'label': 'disappointment', 'score': 0.044849835336208344}, {'label': 'approval', 'score': 0.04001116380095482}, {'label': 'realization', 'score': 0.03387437388300896}, {'label': 'annoyance', 'score': 0.023632477968931198}]"
NF|||I’ll Keep On|||65|||1,NF,I’ll Keep On,"Faith is something I am not accustomed to
And trusting other people's something I don't really love to do
I've never been a fan of it, I act tougher
Really my shoulders they ain't built for this and I don't have nothing
It's like I'm standing in the rain and you offer me a raincoat
But I would rather stand there and get wet than take the handout
What's wrong with me? You said you've always got your hands out
And I cannot continue on my own, so take my hands now
I give you everything, God, not just a little bit
Take it from me, I am nothing but a hypocrite
I hate sin, but I built a house and I still live in it
Afraid to open up the door to You and let You into it
My soul is lost and what it needs is Your direction
I know, I've told You I do not need Your protection
But I lied to You, this thing is tiring
And man was not created for it, God
Please retire me now",NF|||I’ll Keep On|||65,1,disapproval,disappointment,annoyance,"[{'label': 'disapproval', 'score': 0.21709023416042328}, {'label': 'disappointment', 'score': 0.19978570938110352}, {'label': 'annoyance', 'score': 0.18060925602912903}, {'label': 'sadness', 'score': 0.12380804121494293}, {'label': 'anger', 'score': 0.09494128823280334}, {'label': 'fear', 'score': 0.08495885133743286}]"
