id,artist_name,song_title,lyrics,parent_id,chunk_order,primary_emotion,secondary_emotion,tertiary_emotion,classification_result
NF|||TRUST|||27|||0,NF,TRUST,"```
<Artist name> NF <\Artist>
<Song title> TRUST <\Song title>
<Lyric> 
Focus on it every single day, I wanna figure out a way
To get ahead of what I think I know is comin'
It's obvious you got a problem if you always tryna make it seem
As if you've never been afraid, then why you runnin'?
I could never look at what I do the way that other people can
And walk away, I can't be separated from it
Stickin' out my neck is how I made it where I'm at
You wanna cut it up but can't, man, they can never take it from me
(I'm) Outlandish, take chances
Gotta get it while I can with my damage
My sanity could leave but if it vanished
Don't matter to me, I'd still manage
Gue-guеss you could say I'm at an advantage
My vantage point can be quitе lavish
Got so many cadences, no way to pick
One, which bag is my hand in
Depends what mood I'm in
Oh, no, I'm in a mood again
Lord knows I'm a hooligan
Losin' it, who can get gruesome with
You if it comes down to it?
You can bet I shoot direct, defuse the threat
And they wonder why the music has a huge effect?
Could it be 'cause I've been the go-to when it comes to depth?
'Cause I'm the one that they be callin' when the people get fed up
And want the music with the visuals, I got a vendetta
For any part of me that wanna make it hard to get set up
But take away the happiness, it can be kinda pathetic
But when I look at everything that's tryna give me a headache
I gotta be honest, I really been the cause of it, get it
'Cause I can see a side of me you'll never see, you can tell
When I'm at the breakin' point, I finally had to sit with the devil
I went into hell and I asked him what the problem is, yellin'
He tried to get me to live with him, even called me a sinner
And told me everything about me doesn't feel like a winner
So why continue when he's tellin' me I might as well give up?
I took a moment, thought about it, feelin' caught in the middle
But got offended when he told me I would live in a kennel
And I can never leave it, even if I made it to Heaven
He'd find a way to get me back and send a demon to get me
I'm like, ""Woah (Woah), hold up, I don't think so""
Skin and bones meet my ego
How's he look? He don't eat much
Let him starve, I don't feed him
I just beat him, I just leave him in his womb, in the fetal
Let him cry, let him yell, let him scream, I don't need him
Lift off when I'm ticked off, my pitfalls I latch on to like a pit dog
I sit calm with a sick thought of a sitcom of the life I live
Life I live's more like a sci-fi flick
I hide in, wanna watch? Dive right in
My silence doesn't mean I'm dyin'
Just means I'm careful with the time I spend, so",NF|||TRUST|||27,0,disappointment,annoyance,disapproval,"[{'label': 'neutral', 'score': 0.4697434902191162}, {'label': 'disappointment', 'score': 0.2668597996234894}, {'label': 'annoyance', 'score': 0.16697938740253448}, {'label': 'disapproval', 'score': 0.0679578110575676}, {'label': 'curiosity', 'score': 0.06655216962099075}, {'label': 'confusion', 'score': 0.0618579126894474}]"
NF|||TRUST|||27|||1,NF,TRUST,"(Look, look) Look what I, look what I done (Ayy)
Helpin' 'em people I love (I love)
My life is not what it was (No)
I'll do whatever I must (Woo)
Count on one hand who I trust (Ayy)
Count on one hand who I trust (Yeah)
Count on one hand who I trust (Ayy)
Count on one hand who I trust (Ayy)",NF|||TRUST|||27,1,love,approval,caring,"[{'label': 'love', 'score': 0.7248117923736572}, {'label': 'neutral', 'score': 0.32047003507614136}, {'label': 'approval', 'score': 0.1971503049135208}, {'label': 'caring', 'score': 0.02563587948679924}, {'label': 'optimism', 'score': 0.02436499297618866}, {'label': 'admiration', 'score': 0.01048996765166521}]"
NF|||TRUST|||27|||2,NF,TRUST,"Tech N9na, next king up
Everyone knowin' that I'm a death bringer
That lingua vexing ya
Leavin' a regular rapper resting, bruh (Chyeah)
This is what, I give it such
An incredible wicked rush, a vivid gush
Of poetical livid stuff to rid his gruff
Said, I better go rip it rough and I lit it up
The prestige I gather from people lovin' the Tech speed (Whoop)
Lyrically elect me, Jet Li
The beat, it got ya bobbin' until your neck bleed (Whoop)
That is tellin' me ""Let's feed""
On the bitter the bogus the hitter will focus
Deliver the doses and give a critter the dopest
Spitter to flow sick and now the quitter corrosive
A swig of the roguish'll give your liver cirrhosis (Chyeah)
The boogie monster reppin' with NF in the hoodie
Want to step into the session and fully conquer
The weapon to lessen our profession go bully bonkers (Chyeah)
Left in a wreck, never checkin' nor could he stomp us
Take his crown
Thought he was gonna make us run away in a battle with his fakeish frown
Shake his ground
Like I'm the Mechagodzilla, I'm such a killer when I break it down (Uh)
These flows are the cheat code for the weak Joes
That need those elite bros with the heat, so
They can eat on the D low
Off a beast yo' ego, got it vetoed (Chyeah)
Please close your beak foes, delete scrolls
Taken from me, thieves chose to try to decode (Chyeah)
Reload the beat, so I can reach each soul
No cease, no finito, release (Go!)
I am the chosen and everyone is beholdin'
My energy is golden 'cause dominion is being broken
From enemies in the open approachin', I'm never jokin'
The remedy bein' spoken, I'm hopin' that you're soakin' it up (Chyeah)
I'm in the motion, I'm dope and I'm never chokin'
My devotion to floatin' like an ocean, the Holy Ghost and
I'm scopin' the evil folk and revokin' the wicked notion
I'm croakin', I'm really floatin' and quotin' that I'm closin' it up (Chyeah)
Talkin' behind my back
End up where N9ne is at see me and say
Kinda wack, you could not find the knack
Hit you with a rhyme attack freely and spray
I'ma beat you 'cause I'm greedy and slay, if you're creepy and cray
I'ma eat you like PB&J, kiwi and grapes
I'ma demolish 'em when the T be in play, pray!
A stunna recordin' in my number three Jordans
Dungaree sportin', the tongue on me is gonna be scorchin'
The punishin' hunter eat like a hung-ary orphan (Chyeah)
T9 and NF are elephants
In the room without a closet for skeletons
Quit embellishin', a demon from hell is sent
Yell it went, Donny, you're outta your element! (Ayy)",NF|||TRUST|||27,2,annoyance,approval,realization,"[{'label': 'neutral', 'score': 0.9542403817176819}, {'label': 'annoyance', 'score': 0.025237105786800385}, {'label': 'approval', 'score': 0.022994428873062134}, {'label': 'realization', 'score': 0.0055017368867993355}, {'label': 'anger', 'score': 0.0051690987311303616}, {'label': 'admiration', 'score': 0.004676405806094408}]"
NF|||TRUST|||27|||3,NF,TRUST,"Look what I, look what I done (Ayy)
Helpin' 'em people I love (I love)
My life is not what it was (No)
I'll do whatever I must (Woo)
Count on one hand who I trust (Ayy)
Count on one hand who I trust (Yeah)
Count on one hand who I trust (Ayy)
Count on one hand who I trust (Ayy)
Look what I, look what I done (What I done)
Helpin' 'em people I love (I love)
My life is not what it was (No)
I'll do whatever I must (Woo)
Count on one hand who I trust (I trust; ayy)
Count on one hand who I trust (I trust; yeah)
Count on one hand who I trust (Ayy)
Count on one hand who I trust
<\Lyric>```",NF|||TRUST|||27,3,love,approval,caring,"[{'label': 'love', 'score': 0.7763684391975403}, {'label': 'neutral', 'score': 0.2785838842391968}, {'label': 'approval', 'score': 0.1864420771598816}, {'label': 'caring', 'score': 0.021337131038308144}, {'label': 'optimism', 'score': 0.020730026066303253}, {'label': 'admiration', 'score': 0.01082414947450161}]"
NF|||10 Feet Down|||28|||0,NF,10 Feet Down,"```
<Artist name> NF <\Artist>
<Song title> 10 Feet Down <\Song title>
<Lyric> 
Pu gnisir ,gnisir eb ll'I tuB
​efil elohw ym ylraen nwod teef neT
​thgin lla ,thgin llA
​pu ti llif am'I ,llif am'I
​ekil puc ytpme na ta nwod gniratS
​thgin gnol ,sthgin dloc ,sthgin dloC",NF|||10 Feet Down|||28,0,approval,annoyance,realization,"[{'label': 'neutral', 'score': 0.9692786931991577}, {'label': 'approval', 'score': 0.012430649250745773}, {'label': 'annoyance', 'score': 0.0066794585436582565}, {'label': 'realization', 'score': 0.00583393732085824}, {'label': 'disapproval', 'score': 0.004162874538451433}, {'label': 'disappointment', 'score': 0.003611526684835553}]"
NF|||10 Feet Down|||28|||1,NF,10 Feet Down,"Yeah, I know the person in the mirror's not a perfect one
I look at him every day and think he's not enough
My life's a book that I don't really like to open up
I'm twenty-six, but I feel like I live in chapter one
I skim through it, I've been through it, they laugh at us
You think it's funny, yeah, laugh it up
I always felt like no one listened to me, that's how I grew up
Church is where I found God, but it's also where I learned to judge
Yeah, I had to learn there's a difference between
What you want, and what you really need
I've always been motivated by comments from people tellin' me things they think I'll never be
And then I become it, this is my everything
There's so much that goes on in my head that people will never see
You probably be terrified of my memories, don't lecture me
Let me be, let me see, let me breathe, how they remember me
Doesn't alter who I am as a person to take my energy, yeah",NF|||10 Feet Down|||28,1,realization,annoyance,approval,"[{'label': 'neutral', 'score': 0.2622683048248291}, {'label': 'realization', 'score': 0.19246645271778107}, {'label': 'annoyance', 'score': 0.13682688772678375}, {'label': 'approval', 'score': 0.12396179884672165}, {'label': 'amusement', 'score': 0.11010958254337311}, {'label': 'disappointment', 'score': 0.047599274665117264}]"
NF|||10 Feet Down|||28|||2,NF,10 Feet Down,"Hard days, cold nights
Staring down at an empty cup like
I'ma fill, I'ma fill it up
All day, all night
Ten feet down nearly my whole life
But I'll be rising, rising up
Sthgin dloC",NF|||10 Feet Down|||28,2,approval,annoyance,realization,"[{'label': 'neutral', 'score': 0.9628556370735168}, {'label': 'approval', 'score': 0.016651548445224762}, {'label': 'annoyance', 'score': 0.008900748565793037}, {'label': 'realization', 'score': 0.008222515694797039}, {'label': 'optimism', 'score': 0.0034095679875463247}, {'label': 'joy', 'score': 0.003216213546693325}]"
NF|||10 Feet Down|||28|||3,NF,10 Feet Down,"Yeah, my fans made me who I am, but they also deceived me
I've been allowed to live life like I'm already grieving
I'm at a table of liars but don't eat what they feed me
My hoodie over my face, so nobody can see me
I'm on a plane, 'bout to fly again
Looking out the window, take a moment to admire it
Wondering how high it is, wonder where the time has went
Then I shut the window and go back to feeling like I'm out my mind again, agh!
Yeah, seems like we're all trying to climb a ladder
It's crazy what we'll do to climb it faster
It's like we throw away the things in life that really matter
Just so we can make it to the top and wonder what we're even climbing after
I know the feeling of feeling like everything that you deal with
Don't never change, that's part of being a human, yeah
Life's what you make of it, take it, embrace it, and take it, and savor it
Ain't about what you did, it's what you became from it, agh!",NF|||10 Feet Down|||28,3,disappointment,realization,annoyance,"[{'label': 'neutral', 'score': 0.2586362063884735}, {'label': 'disappointment', 'score': 0.1495736986398697}, {'label': 'realization', 'score': 0.13571657240390778}, {'label': 'annoyance', 'score': 0.0864584743976593}, {'label': 'approval', 'score': 0.06671081483364105}, {'label': 'surprise', 'score': 0.042986731976270676}]"
NF|||10 Feet Down|||28|||4,NF,10 Feet Down,"Hard days, cold nights
Staring down at an empty cup like
I'ma fill, I'ma fill it up (oh, yeah)
All day, all night
Ten feet down nearly my whole life
But I'll be rising, rising up
Sthgin dloC",NF|||10 Feet Down|||28,4,approval,realization,annoyance,"[{'label': 'neutral', 'score': 0.9558171629905701}, {'label': 'approval', 'score': 0.023184755817055702}, {'label': 'realization', 'score': 0.009261658415198326}, {'label': 'annoyance', 'score': 0.008508183993399143}, {'label': 'excitement', 'score': 0.0035756900906562805}, {'label': 'joy', 'score': 0.0035466128028929234}]"
NF|||10 Feet Down|||28|||5,NF,10 Feet Down,"We all want what we never had
The good life doesn't seem so bad
The good life doesn't seem so sad
Yeah, we all want what we never had, whoa",NF|||10 Feet Down|||28,5,desire,approval,joy,"[{'label': 'desire', 'score': 0.34482255578041077}, {'label': 'neutral', 'score': 0.13200807571411133}, {'label': 'approval', 'score': 0.12011197954416275}, {'label': 'joy', 'score': 0.09193665534257889}, {'label': 'disappointment', 'score': 0.07915277034044266}, {'label': 'sadness', 'score': 0.03547687828540802}]"
NF|||10 Feet Down|||28|||6,NF,10 Feet Down,"Hard days, cold nights
Staring down at an empty cup like
I'ma fill, I'ma fill it up
All day, all night
Ten feet down nearly my whole life
But I'll be rising, rising up",NF|||10 Feet Down|||28,6,approval,realization,annoyance,"[{'label': 'neutral', 'score': 0.9581739902496338}, {'label': 'approval', 'score': 0.019829940050840378}, {'label': 'realization', 'score': 0.009363530203700066}, {'label': 'annoyance', 'score': 0.008525845594704151}, {'label': 'optimism', 'score': 0.004592158831655979}, {'label': 'joy', 'score': 0.0033303655218333006}]"
NF|||10 Feet Down|||28|||7,NF,10 Feet Down,"We all want what we never had
The good life doesn't seem so bad
The good life doesn't seem so sad
Yeah, we all want what we never had",NF|||10 Feet Down|||28,7,desire,approval,disappointment,"[{'label': 'desire', 'score': 0.3955833315849304}, {'label': 'neutral', 'score': 0.13698284327983856}, {'label': 'approval', 'score': 0.11949894577264786}, {'label': 'disappointment', 'score': 0.07105153799057007}, {'label': 'joy', 'score': 0.06759995967149734}, {'label': 'sadness', 'score': 0.03612668067216873}]"
NF|||10 Feet Down|||28|||8,NF,10 Feet Down,"Hard days, cold nights
Staring down at an empty cup like
I'ma fill, I'ma fill it up",NF|||10 Feet Down|||28,8,annoyance,approval,realization,"[{'label': 'neutral', 'score': 0.9540197849273682}, {'label': 'annoyance', 'score': 0.017536122351884842}, {'label': 'approval', 'score': 0.012836159206926823}, {'label': 'realization', 'score': 0.008314548060297966}, {'label': 'sadness', 'score': 0.0061909714713692665}, {'label': 'disappointment', 'score': 0.005823989398777485}]"
NF|||10 Feet Down|||28|||9,NF,10 Feet Down,"​pu gnisir ,gnisir eb ll'I tuB
​efil elohw ym ylraen nwod teef neT
​thgin lla ,thgin llA
​pu ti llif am'I ,llif am'I
​ekil puc ytpme na ta nwod gniratS
​thgin gnol ,sthgin dloc ,sthgin dloC
<\Lyric>```",NF|||10 Feet Down|||28,9,approval,annoyance,realization,"[{'label': 'neutral', 'score': 0.9690209627151489}, {'label': 'approval', 'score': 0.012453651987016201}, {'label': 'annoyance', 'score': 0.006926475092768669}, {'label': 'realization', 'score': 0.005889706313610077}, {'label': 'disapproval', 'score': 0.004397477488964796}, {'label': 'disappointment', 'score': 0.0036638863384723663}]"
NF|||Time (Edit)|||29|||0,NF,Time (Edit),"```
<Artist name> NF <\Artist>
<Song title> Time (Edit) <\Song title>
<Lyric> 
Even if we both break down tonight
And you say you hate me, and we go to bed angry
I know everything will be alright
I'll be here waiting, I promise I'm changing
I just need...",NF|||Time (Edit)|||29,0,desire,annoyance,anger,"[{'label': 'neutral', 'score': 0.32063165307044983}, {'label': 'desire', 'score': 0.19834886491298676}, {'label': 'annoyance', 'score': 0.08575241267681122}, {'label': 'anger', 'score': 0.07891354709863663}, {'label': 'caring', 'score': 0.07161210477352142}, {'label': 'approval', 'score': 0.036572813987731934}]"
NF|||Time (Edit)|||29|||1,NF,Time (Edit),"A little time to show you I'm worth it
I know that I can be a difficult person
I'm a stress case, drive you up the wall when I'm workin'
Actually, I'm probably worse when I'm not, you don't deserve it
Make you nervous 'cause you know I'ma break soon
Every time I do, I say somethin' that hurts you
Actin' like I'm gone, but we both in the same room
I don't like to be wrong, which I know you relate to
And I know I make you feel like you're at the end of your rope
That's when I look at you and tell you I'd be better alone
Just the pride talkin', isn't it? 'Cause both of us know
I'm the definition of ""wreck"" if you look into my soul
Comes out the most when I feel I'm in a vulnerable place
Made a lot of mistakes I wish I knew how to erase
When I'm afraid, might get distant and I push you away
But no matter the case, I'ma do whatever it takes even if—",NF|||Time (Edit)|||29,1,nervousness,sadness,fear,"[{'label': 'nervousness', 'score': 0.2831443250179291}, {'label': 'sadness', 'score': 0.20556992292404175}, {'label': 'neutral', 'score': 0.16408097743988037}, {'label': 'fear', 'score': 0.12954580783843994}, {'label': 'disappointment', 'score': 0.10352678596973419}, {'label': 'caring', 'score': 0.07960907369852066}]"
NF|||Time (Edit)|||29|||2,NF,Time (Edit),"Even if we both break down tonight
And you say you hate me, and we go to bed angry
I know everything will be alright
I'll be here waiting, I promise I'm changing
I just need…",NF|||Time (Edit)|||29,2,desire,annoyance,anger,"[{'label': 'neutral', 'score': 0.30012813210487366}, {'label': 'desire', 'score': 0.20930428802967072}, {'label': 'annoyance', 'score': 0.0940682515501976}, {'label': 'anger', 'score': 0.08869211375713348}, {'label': 'caring', 'score': 0.06583701074123383}, {'label': 'approval', 'score': 0.03409472480416298}]"
NF|||Time (Edit)|||29|||3,NF,Time (Edit),"Time (Oh)
I, I need time (Oh, oh)
I just need time (Oh)
I, I need time (Oh)
Time (Oh), time (Oh)",NF|||Time (Edit)|||29,3,desire,approval,annoyance,"[{'label': 'desire', 'score': 0.5570637583732605}, {'label': 'neutral', 'score': 0.41863808035850525}, {'label': 'approval', 'score': 0.02444463223218918}, {'label': 'annoyance', 'score': 0.02317935787141323}, {'label': 'optimism', 'score': 0.011813114397227764}, {'label': 'disappointment', 'score': 0.010493273846805096}]"
NF|||Time (Edit)|||29|||4,NF,Time (Edit),"Yeah, way before I bought you the ring
We were fighting back and forth like you were wearin' the thing
Two passionate people not afraid to say what they think
Lead to passionate conversation when it's hard to agree
You know me well, sittin' on the edge of my seat
Lookin' at life, overanalyzin' everything
Always depressed, tryna find a better version of me
Searching for somethin' I know's prolly right in front of my feet
Stubborn as me? Maybe not, but you're close to it
Got a lot of issues, I'm tryin' to work through 'em
Going to therapy for you's somethin' that's worth doin'
When I know you been there for me through all of my worst moments
And I know it hurts knowing that I carry this weight on my chest
Making it difficult for me to open up and connect
Lot of regrets, I apologize for all of the stress
That's not what I meant to do, you know I love you to death even if—",NF|||Time (Edit)|||29,4,sadness,remorse,love,"[{'label': 'sadness', 'score': 0.5539261102676392}, {'label': 'remorse', 'score': 0.4152783751487732}, {'label': 'love', 'score': 0.27961716055870056}, {'label': 'disappointment', 'score': 0.1349041610956192}, {'label': 'caring', 'score': 0.07571642100811005}, {'label': 'approval', 'score': 0.04786665737628937}]"
NF|||Time (Edit)|||29|||5,NF,Time (Edit),"Time (Oh)
I, I need time (Oh, oh)
I just need time (Oh)
I, I need time (Oh)
Time (Oh), time (Oh)
I just need time (Oh)
I, I need time (Oh, oh)
I just need time (Oh)
I, I need time (Oh)
Time (Oh), time (Oh)
<\Lyric>```",NF|||Time (Edit)|||29,5,desire,approval,annoyance,"[{'label': 'desire', 'score': 0.5846063494682312}, {'label': 'neutral', 'score': 0.3871038854122162}, {'label': 'approval', 'score': 0.027767363935709}, {'label': 'annoyance', 'score': 0.021414615213871002}, {'label': 'optimism', 'score': 0.012156701646745205}, {'label': 'disappointment', 'score': 0.010076227597892284}]"
NF|||JUST LIKE YOU|||30|||0,NF,JUST LIKE YOU,"```
<Artist name> NF <\Artist>
<Song title> JUST LIKE YOU <\Song title>
<Lyric> 
Just in case my car goes off the highway
Or the plane that I get on decides that it's my last day
I want you to know when you're alone and you feel afraid
You're not the only person in the world that isn't okay
There's millions of us just like you, like you, like you
Just like you, like you
There's millions of us just like you, like you, like you
Just like you, like you",NF|||JUST LIKE YOU|||30,0,fear,caring,desire,"[{'label': 'neutral', 'score': 0.7629174590110779}, {'label': 'fear', 'score': 0.03554081916809082}, {'label': 'caring', 'score': 0.03470059856772423}, {'label': 'desire', 'score': 0.02639022469520569}, {'label': 'approval', 'score': 0.02427840605378151}, {'label': 'realization', 'score': 0.013686586171388626}]"
NF|||JUST LIKE YOU|||30|||1,NF,JUST LIKE YOU,"It's strange the way the mind can wander, but also stop to gossip
And chat with memories that you and me aren't really fond of
Maybe you're out to find love, maybe you lost who you was
Maybе you're just like me and feel thе need to stay in your rut
'Cause if you left it, you might feel like you're no longer you
It's so impressive, the way the mind can play with the truth
It's interestin' that nobody can walk in your shoes
But still relate and feel the same, so in a way, guess we do
You ever think about what it would be like
If the clouds were gone and you could see light?
If the door was open, would you take flight
Or just close the curtains up and stay inside?
Take a walk with me, take a risk with me
I'm scared too and it gets so tempting
When you're so empty, to disown everything
You hold dearly when you know clearly
You been so buried in your own fairytale
The soul's tearin' bunch of holes in me
I relate to it, but in case you been
Thinkin' no one does, here's a great theory
Throw a Hail Mary, let ya mind fly
To the sun rise, could be so scary
Make your faith vary, feel the pain glaring
But the weight carried ain't in vain, hear me? (Hear me?)",NF|||JUST LIKE YOU|||30,1,fear,curiosity,admiration,"[{'label': 'fear', 'score': 0.30595365166664124}, {'label': 'curiosity', 'score': 0.2059444785118103}, {'label': 'admiration', 'score': 0.1807696670293808}, {'label': 'neutral', 'score': 0.1078018844127655}, {'label': 'confusion', 'score': 0.08802685141563416}, {'label': 'approval', 'score': 0.06350173056125641}]"
NF|||JUST LIKE YOU|||30|||2,NF,JUST LIKE YOU,"So often I feel desperate, I think my heart's infected
How 'bout yours? How 'bout yours? How 'bout yours? I guess if
You feel the best when your life is hectic, you might be destined
To stay defective, so join the club, it ain't that hard to get in
It's hard to leave though, look at the guest list
I bet that your name is on it, don't believe me? Check it
See dead ends
In life we come to tend to raise some questions
Suggestion
Know that your feelings might give wrong directions (Infested)
Yeah, with the feeling of failure
Let it take over your body, it makes ya
Question the life that you have, situations
You might have enjoyed become nothin' but dated
Old and forgotten, but what would you say if
I told you that there was some hope we could make it?
I know what you're thinkin', I'm thinkin' it too
Could you really improve and be somethin' worth savin'?
See, I could pretend like I have all the answers
But none of us do, it's the reason we battle
Convincing yourself that you don't really matter's
Like feedin' a cancer and letting it travel
To every part of you, but what if we did
The unthinkable and cancel our trips?
What's achievable depends on the risk
So pick up your chin and listen to this",NF|||JUST LIKE YOU|||30,2,curiosity,confusion,disappointment,"[{'label': 'neutral', 'score': 0.5185218453407288}, {'label': 'curiosity', 'score': 0.16733063757419586}, {'label': 'confusion', 'score': 0.08378028124570847}, {'label': 'disappointment', 'score': 0.05547213926911354}, {'label': 'optimism', 'score': 0.037110742181539536}, {'label': 'approval', 'score': 0.03608691692352295}]"
NF|||JUST LIKE YOU|||30|||3,NF,JUST LIKE YOU,"Just in case my car goes off the highway
Or the plane that I get on decides that it's my last day
I want you to know when you're alone and you feel afraid
You're not the only person in the world that isn't okay
There's millions of us just like you, like you, like you
Just like you, like you
There's millions of us just like you, like you, like you
Just like you, like you (You, you, you, you)",NF|||JUST LIKE YOU|||30,3,fear,caring,desire,"[{'label': 'neutral', 'score': 0.7979772090911865}, {'label': 'fear', 'score': 0.035436708480119705}, {'label': 'caring', 'score': 0.024974990636110306}, {'label': 'desire', 'score': 0.02330460399389267}, {'label': 'approval', 'score': 0.02139808051288128}, {'label': 'realization', 'score': 0.013322114013135433}]"
NF|||JUST LIKE YOU|||30|||4,NF,JUST LIKE YOU,"Yeah, everybody falls sometimes
Just remember that that's alright
It's the rainy days that give us love for the sun
And if it isn't, I guess I'll be fine believin' it does, oh yeah
Everybody falls sometimes
Just remember that that's alright
It's the lows in life that make you cherish the highs
And if it isn't, I guess I'll be fine believin' a lie (Ayy)
<\Lyric>```",NF|||JUST LIKE YOU|||30,4,approval,love,caring,"[{'label': 'approval', 'score': 0.481662780046463}, {'label': 'love', 'score': 0.41225695610046387}, {'label': 'caring', 'score': 0.35385262966156006}, {'label': 'optimism', 'score': 0.12353922426700592}, {'label': 'joy', 'score': 0.060568422079086304}, {'label': 'neutral', 'score': 0.0537298284471035}]"
